Reference No.,Tendering Procedure,Title or Scope,Contractor(s) and Address(es),Item/Quantity,Awarded Amount,Date Awarded,Source_File,Year,Source_Month,Source_URL
Q075807,Selective,Provision of Maintenance and Support Service for Access Control Related System,"Hong Kong Telecommunications (HKT) Limited27/F, PCCW Tower, Taikoo Place979 King's RoadQuarry BayHong Kong",1 Job,"HK$14,502,500",19 Jul 2020,MTR_Tender_Jul20_table1.csv,2020,Jul20,https://www.mtr.com.hk/en/corporate/tenders/Jul20.html
Q077956,Selective,Provision and Implementation of HR Services Delivery Platform (Package 1),"Deloitte Advisory Hong Kong Limited35/F, One Pacific88 QueenswayHong Kong",1 Job,"HK$2,088,065.36",3 Jul 2020,MTR_Tender_Jul20_table1.csv,2020,Jul20,https://www.mtr.com.hk/en/corporate/tenders/Jul20.html
M1201-19E,Selective,Maintenance Services for ECS Ventilation System (Pacakge A),"REC Engineering Company LimitedUnits A-D, 15/F, Goodman Kwai Chung Logistics Centre585-609 Castle Peak RoadKwai Chung, New TerritoriesHong Kong",Not Applicable,"HK$52,717,180",22 May 2020,MTR_Tender_May20_table1.csv,2020,May20,https://www.mtr.com.hk/en/corporate/tenders/May20.html
Q069799,Selective,Supply of Rectifier Transformers for Power Supply System in MTR,Transformers & Rectifiers Ltd.15-16 Woodbridge MeadowsGuildfordSurrey GU1 1BJUnited Kingdom,1 Unit,"GBP267,470",25 May 2020,MTR_Tender_May20_table1.csv,2020,May20,https://www.mtr.com.hk/en/corporate/tenders/May20.html
Q070461,Selective,Distribution of Free Daily Newspaper in MTR Stations,"Hong Kong Headline Daily Publishing LimitedSing Tao News Corporation Building7 Chun Cheong StreetTseung Kwan O Industrial EstateTseung Kwan O, New TerritoriesHong Kong",1 Job,Not Disclosed,12 May 2020,MTR_Tender_May20_table1.csv,2020,May20,https://www.mtr.com.hk/en/corporate/tenders/May20.html
Q070868,Selective,Supply of 5.5 Ton Lorries,"Triangel Motors Ltd12/F, Union Park Centre771-775 Nathan RoadKowloonHong Kong",11 Units,"HK$5,342,304",5 May 2020,MTR_Tender_May20_table1.csv,2020,May20,https://www.mtr.com.hk/en/corporate/tenders/May20.html
Q071914,Selective,Supply of Traction Batteries for Battery Electric Locomotives,"Infinitier Company LimitedRoom 601, Bupa Centre141 Connaught Road WestHong Kong",241 Crates,"HK$19,280,000",25 May 2020,MTR_Tender_May20_table1.csv,2020,May20,https://www.mtr.com.hk/en/corporate/tenders/May20.html
Q072672,Selective,"Provision of Collection, Conveyance and Disposal of Sewage Discharged for Shek Kong Stabling Siding","Man Kee Engineering Company LimitedUnit C, 8/F, Unison Industrial Building7 Sun Yip StreetChai WanHong Kong",2 Years,"HK$5,155,604",14 May 2020,MTR_Tender_May20_table1.csv,2020,May20,https://www.mtr.com.hk/en/corporate/tenders/May20.html
Q073200,Selective,Provision of Security Guarding Services and Customer Service Ambassador Personnel for The LOHAS,"Express Security LimitedUnit 01-02, 16/F, Vanta Industrial Centre21-33 Tai Lin Pai RoadKwai Chung, New TerritoriesHong Kong",1 Job,Not Disclosed,25 May 2020,MTR_Tender_May20_table1.csv,2020,May20,https://www.mtr.com.hk/en/corporate/tenders/May20.html
Q073201,Selective,Provision of Comprehensive Cleaning Services for The LOHAS,"Winson Cleaning Service Co LtdSuite 2702, 27/F, Tower 2, Nina Tower8 Yeung Uk RoadTsuen Wan, New TerritoriesHong Kong",1 Job,Not Disclosed,25 May 2020,MTR_Tender_May20_table1.csv,2020,May20,https://www.mtr.com.hk/en/corporate/tenders/May20.html
Q074513,Selective,Group Medical Insurance for Employees and Eligible Dependants 2020-2022,"AIA International Limited12/F, Kerry Centre683 King's RoadQuarry BayHong Kong",2 Years,Not Disclosed,26 May 2020,MTR_Tender_May20_table1.csv,2020,May20,https://www.mtr.com.hk/en/corporate/tenders/May20.html
Q075941,Selective,"Sale of Used Rails, Wheels and the Associated Miscellaneous Items","Advance Prosperity Engineering LimitedFlat 1501, Millennium City 5418 Kwun Tong RoadKwun Tong, KowloonHong Kong",1 Year,Not Disclosed,8 May 2020,MTR_Tender_May20_table1.csv,2020,May20,https://www.mtr.com.hk/en/corporate/tenders/May20.html
8237,Open,Additional Office Modification Works at West Kowloon Station,"BYME Engineering (HK) Ltd.Unit 2101, 21/FIsland Place Tower510 King's RoadNorth PointHong Kong",Not Applicable,"HK$25,185,000",19 Oct 2020,MTR_Tender_Oct20_table1.csv,2020,Oct20,https://www.mtr.com.hk/en/corporate/tenders/Oct20.html
C7609-20E,Selective,"Replacement of Tunnel Sump Pumps in KTL, TWL, ISL and TKL","Shimizu CorporationRoom 1313-1315Metroplaza Tower 1223 Hing Fong RoadKwai Fong, New TerritoriesHong Kong",Not Applicable,"HK$29,316,627.60",7 Oct 2020,MTR_Tender_Oct20_table1.csv,2020,Oct20,https://www.mtr.com.hk/en/corporate/tenders/Oct20.html
M1208-19E,Selective,"Maintenance Services for AFA, BA and SEC System","Honeywell LimitedUnit 501, 5/FGoldin Financial Global Centre17 Kwai Cheung RoadKowloon Bay, KowloonHong Kong",Not Applicable,"HK$19,599,557.04",5 Oct 2020,MTR_Tender_Oct20_table1.csv,2020,Oct20,https://www.mtr.com.hk/en/corporate/tenders/Oct20.html
Q066212,Open,Supply of Distribution Transformers for Power Supply System in MTR,"Triple Faith Engineering & Supply Limited1/F Lee Chung Industrial Building11 Pat Tat StreetSan Po Kong, KowloonHong Kong",2 Units,"EUR1,163,596.00(eqv. HK$11,235,695.59)",20 Oct 2020,MTR_Tender_Oct20_table1.csv,2020,Oct20,https://www.mtr.com.hk/en/corporate/tenders/Oct20.html
Q071701,Selective,Supply of Two Units of Road Rail Vehicles,"Tong Kee Engineering LimitedUnit P & Q, 11/F, Block 2Kinho Industrial Building14-24 Au Pui Wan StreetFotan, New TerritoriesHong Kong",2 Units,"HK$24,774,880",5 Oct 2020,MTR_Tender_Oct20_table1.csv,2020,Oct20,https://www.mtr.com.hk/en/corporate/tenders/Oct20.html
Q078947,Selective,Group Life Insurance for Employees 2021-2023,"AIA International Limited12/F, Kerry Centre683 King's RoadQuarry BayHong Kong",3 Years,Not Disclosed,13 Oct 2020,MTR_Tender_Oct20_table1.csv,2020,Oct20,https://www.mtr.com.hk/en/corporate/tenders/Oct20.html
Q080031,Limited*,Supply of Spares for Audio-Frequency Track Circuit for TKL Signalling System,"Siemens Mobility LimitedUnits 905-907, 9/F, Tower BManulife Financial Centre223-231 Wai Yip StreetKwun Tong, KowloonHong Kong",22 Items,"HK$24,881,714.09",9 Oct 2020,MTR_Tender_Oct20_table1.csv,2020,Oct20,https://www.mtr.com.hk/en/corporate/tenders/Oct20.html
M1131-16E,Selective,Maintenance Services for DCS (Phase 2),"Huawei International Co. Limited26/F, Tower 6, The GatewayNo. 9 Canton RoadTsim Sha Tsui, KowloonHong Kong",1 Job,"HK$1,148,502.33",24 Jun 2020,MTR_Tender_Jun20_table1.csv,2020,Jun20,https://www.mtr.com.hk/en/corporate/tenders/Jun20.html
Q072036,Selective,"Provision of Transformer Insulation Oil Sample Collection, Testing and Analysis Service","Kum Shing Engineering Company LimitedUG/F, Unit 8, Hong Kong Newport Centre Phase II116 Ma Tau Kok RoadKowloonHong Kong",1 Job,"HK$8,745,000",3 Jun 2020,MTR_Tender_Jun20_table1.csv,2020,Jun20,https://www.mtr.com.hk/en/corporate/tenders/Jun20.html
Q072917,Selective,Supply of Uniform for Maintenance Staff for 3 Years,"Antonhill Co LtdFlat B, 2/F, Block 2Kwai Tak Industrial Centre15-33 Kwai Tak StreetKwai Chung, New TerritoriesHong Kong",1 Job,"HK$26,914,100.5",15 Jun 2020,MTR_Tender_Jun20_table1.csv,2020,Jun20,https://www.mtr.com.hk/en/corporate/tenders/Jun20.html
Q074014,Selective,Provision of Automatic Air-Conditioning Filters Cleaning Machines,"Kan-Pacific Technology (Hong Kong) LimitedFlat 12, 9/FYue Fung Industrial Building35-45 Chai Wan Kok StreetTsuen Wan, New TerritoriesHong Kong",3 Units,"HK$3,300,000",9 Jun 2020,MTR_Tender_Jun20_table1.csv,2020,Jun20,https://www.mtr.com.hk/en/corporate/tenders/Jun20.html
Q074777,Selective,Combined Managed Security Services (MSS) for IT and OT,"Singapore Telecom Hong Kong Limited21/F, 1063 King's RoadQuarry BayHong Kong",1 Job,"HK$31,890,473",11 Jun 2020,MTR_Tender_Jun20_table1.csv,2020,Jun20,https://www.mtr.com.hk/en/corporate/tenders/Jun20.html
Q077956,Selective,Provision and Implementation of HR Services Delivery Platform (Package 2),"ServiceNow Nederland B.V.Hoekenrode 3, 1102BRAmsterdamNetherlands",1 Job,"HK$4,840,204.65",29 Jun 2020,MTR_Tender_Jun20_table1.csv,2020,Jun20,https://www.mtr.com.hk/en/corporate/tenders/Jun20.html
C5673.B-19C,Selective,Station Improvement Works at Kwun Tong Station,"Shimizu CorporationRoom 1313-1315Metroplaza Tower 1223 Hing Fong RoadKwai Fong, New TerritoriesHong Kong",Not Applicable,"HK$46,879,939",14 Dec 2020,MTR_Tender_Dec20_table1.csv,2020,Dec20,https://www.mtr.com.hk/en/corporate/tenders/Dec20.html
M1218-20E,Selective,Maintenance Services for Main Control Systems and SCADA,Thales Transport & Security (Hong Kong) LimitedUnits 1106-07New Kowloon Plaza38 Tai Kok Tsui RoadKowloonHong Kong,Not Applicable,"HK$108,000,000",17 Dec 2020,MTR_Tender_Dec20_table1.csv,2020,Dec20,https://www.mtr.com.hk/en/corporate/tenders/Dec20.html
M1220-20E,Selective,Maintenance Services for Packaged Air Conditioners,"EEB-ALCC Joint VentureUnit D5-D6A, 15/F, TML Tower3 Hoi Shing RoadTsuen Wan, New TerritoriesHong Kong",1 Job,"HK$60,323,343",16 Dec 2020,MTR_Tender_Dec20_table1.csv,2020,Dec20,https://www.mtr.com.hk/en/corporate/tenders/Dec20.html
Q072045,Selective,Supply of  Overhead Line Scaffolding Track Trolley for MTR,"Design, Prototype, Manufacture and Supply LimitedPO Box 4945Sheffield S11 0FQUnited Kingdom",72 Units,"HK$7,986,600",1 Dec 2020,MTR_Tender_Dec20_table1.csv,2020,Dec20,https://www.mtr.com.hk/en/corporate/tenders/Dec20.html
Q073607,Open,Supply of Contactless Smart Cards in 2021 and 2022,"Shenzhen Silone Cardtech Co.,Ltd.Office 1003, A FloorNo 527 Middle Huaihai RoadHuangpu District, ShanghaiChina",Not Applicable,"HK$10,920,000* Provisional Contract Sum based on Quantity Allocation",17 Dec 2020,MTR_Tender_Dec20_table1.csv,2020,Dec20,https://www.mtr.com.hk/en/corporate/tenders/Dec20.html
Q075489,Selective,Supply and Installation of CCTV System for MTR Managed Properties and Malls,"ATAL Building Services Engineering Limited13/F, Island Place Tower510 King's RoadNorth PointHong Kong",1 Job,"HK$52,775,690",4 Dec 2020,MTR_Tender_Dec20_table1.csv,2020,Dec20,https://www.mtr.com.hk/en/corporate/tenders/Dec20.html
Q076641 (Package A),Selective,Term Contracts for General Building Repair and Shop Repartitioning Works for Investment Properties (Package A),"Kar Cheung Engineering CoUnit 7, 17/F Kowloon Plaza485 Castle Peak RoadLai Chi Kok, KowloonHong Kong",3 Years,Not Disclosed,17 Dec 2020,MTR_Tender_Dec20_table1.csv,2020,Dec20,https://www.mtr.com.hk/en/corporate/tenders/Dec20.html
Q076663,Selective,Provision of Safety and Hygiene Audit and Inspection Services for MTR Malls,"Industrial Technology Consultants LimitedRoom 1105, 11/FKnutsford Commercial Building4 Knutsford TerraceTsim Sha Tsui, KowloonHong Kong",3 Years,Not Disclosed,30 Dec 2020,MTR_Tender_Dec20_table1.csv,2020,Dec20,https://www.mtr.com.hk/en/corporate/tenders/Dec20.html
Q076738,Selective,Maintenance Services for MVAC System at Investment Properties,"The Jardine Engineering Corporation, Limited5/F Tower AManulife Financial Centre223-231 Wai Yip StreetKwun Tong, KowloonHong Kong",3 Years,"HK$20,182,000",24 Dec 2020,MTR_Tender_Dec20_table1.csv,2020,Dec20,https://www.mtr.com.hk/en/corporate/tenders/Dec20.html
Q077262,Selective,Provision of Social Media Agency Services for Branding & Communications Campaigns,"CMRS Digital Solutions Ltd.Unit B, 18/F, MG Tower133 Hoi Bun RoadKwun Tong, KowloonHong Kong",2 Years,Not Disclosed,24 Dec 2020,MTR_Tender_Dec20_table1.csv,2020,Dec20,https://www.mtr.com.hk/en/corporate/tenders/Dec20.html
Q078340,Selective,"Supply of Diesel Medium Goods Vehicles (Schedule 1, 2A & 2B)","Triangle Motors Limited12/F, Union Park Centre771-775 Nathan RoadKowloonHong Kong",3 Units,"HK$2,403,492",1 Dec 2020,MTR_Tender_Dec20_table1.csv,2020,Dec20,https://www.mtr.com.hk/en/corporate/tenders/Dec20.html
Q078814,Limited*,Blanket Purchase Agreement for Pandrol Trackwork Fastening Proprietary Products,"Pandrol Australia Pty Ltd7 Bessemer StreetBlacktownNSW, 2148Australia","36 Items / 2,332 Pieces","GBP2,384,344.35(estimated ceiling sum)",10 Dec 2020,MTR_Tender_Dec20_table1.csv,2020,Dec20,https://www.mtr.com.hk/en/corporate/tenders/Dec20.html
T0964-20C,Selective,Provision of Term Workers for Station Based Maintenance,"Hop Yuen Construction Company2/F, Hop Yuen Centre171 Queen's Road CentralHong Kong",Not Applicable,Not Disclosed,16 Dec 2020,MTR_Tender_Dec20_table1.csv,2020,Dec20,https://www.mtr.com.hk/en/corporate/tenders/Dec20.html
Q070451,Selective,Provision of Armoured Transportation Service and Ticket Processing Centre Service for MTR Operations,"Vpower Finance Security (Hong Kong) Ltd.Unit 703, 7/FGoodman Global Gateway168 Yeung Uk RoadTsuen Wan, New TerritoriesHong Kong",2 Years,"HK$46,577,437.68",9 Nov 2020,MTR_Tender_Nov20_table1.csv,2020,Nov20,https://www.mtr.com.hk/en/corporate/tenders/Nov20.html
Q076641 (Package B),Selective,Term Contracts for General Building Repair and Shop Repartitioning Works for Investment Properties (Package B),"Jetline Construction Company Limited1/F, Kiu Yin Commercial Building361-363 Lockhart RoadWanchaiHong Kong",1 Job,Not Disclosed,21 Nov 2020,MTR_Tender_Nov20_table1.csv,2020,Nov20,https://www.mtr.com.hk/en/corporate/tenders/Nov20.html
Q077211,Selective,Provision of Promoter Services for MTR Malls,"Certis Centurion Facility Company LimitedUnit 2008-2011, 20/FCDW Building388 Castle Peak RoadTsuen Wan, New TerritoriesHong Kong",3 Years,"HK$21,788,100",2 Nov 2020,MTR_Tender_Nov20_table1.csv,2020,Nov20,https://www.mtr.com.hk/en/corporate/tenders/Nov20.html
Q080703,Limited*,Blanket Purchase Agreement for Railtech Trackwork Welding Proprietary Products,Railtech Australia LimitedPO Box 6211Acacia Ridge DCQLD 4110Australia,"36 Items / 2,332 Pieces","AUD$1,000,000",30 Nov 2020,MTR_Tender_Nov20_table1.csv,2020,Nov20,https://www.mtr.com.hk/en/corporate/tenders/Nov20.html
T5948-20E,Selective,Term Contract for Replacement of Packaged Air Conditioners,"ATAL Building Services Engineering LimitedUnit 102, 1/FShui Hing Centre13 Sheung Yuet RoadKowloon Bay, KowloonHong Kong",Not Applicable,"HK$180,000,000 in respect of accumulated values of all Work Orders",6 Nov 2020,MTR_Tender_Nov20_table1.csv,2020,Nov20,https://www.mtr.com.hk/en/corporate/tenders/Nov20.html
8238,Open,Enhanced Security Access Control at West Kowloon Station,"Siemens Mobility LimitedUnits 905-907, 9/F, Tower BManulife Financial Centre223-231 Wai Yip StreetKwun Tong, KowloonHong Kong",Not Applicable,"HK$26,368,463",14 Sep 2020,MTR_Tender_Sep20_table1.csv,2020,Sep20,https://www.mtr.com.hk/en/corporate/tenders/Sep20.html
A253-20E,Selective,Consultancy Services for the Replacement of Chillers,"Meinhardt (M&E) Limited10/F, Genesis33-35 Wong Chuk Hang RoadHong Kong",Not Applicable,"HK$4,105,000",22 Sep 2020,MTR_Tender_Sep20_table1.csv,2020,Sep20,https://www.mtr.com.hk/en/corporate/tenders/Sep20.html
C5699-19E (Package A & C),Selective,"Replacement Work of UPS, Batteries and Chargers for URL, AEL, TCL, EAL, MOL and WRL (Package A & C)","Schneider Electric IT Hong Kong Limited11/F, Kerry Centre683 King's RoadQuarry BayHong Kong",Not Applicable,"HK$26,636,400",28 Sep 2020,MTR_Tender_Sep20_table1.csv,2020,Sep20,https://www.mtr.com.hk/en/corporate/tenders/Sep20.html
C5699-19E (Package B),Selective,"Replacement Work of UPS, Batteries and Chargers for URL, AEL, TCL, EAL, MOL and WRL (Package B)","Astrid Electronics HK LimitedFlat/Room C-DLucky Factory Building63-65 Hung To RoadKwun Tong, KowloonHong Kong",Not Applicable,"HK$2,750,000",28 Sep 2020,MTR_Tender_Sep20_table1.csv,2020,Sep20,https://www.mtr.com.hk/en/corporate/tenders/Sep20.html
M1190-19E,Selective,Maintenance Support Services for Telephone Systems,"Hong Kong Telecommunications (HKT) Limited27/F, PCCW Tower, Taikoo Place979 King’s RoadQuarry BayHong Kong",Not Applicable,"HK$7,000,000",29 Sep 2020,MTR_Tender_Sep20_table1.csv,2020,Sep20,https://www.mtr.com.hk/en/corporate/tenders/Sep20.html
M1210.A-20E,Selective,Maintenance Services for Wastewater Treatment Plants,"Kingsford Environmental Engineering LimitedSuite 3810, 38/F, Cable TV Tower9 Hoi Shing RoadTsuen Wan, New TerritoriesHong Kong",Not Applicable,"HK$18,508,800",4 Sep 2020,MTR_Tender_Sep20_table1.csv,2020,Sep20,https://www.mtr.com.hk/en/corporate/tenders/Sep20.html
M1210.B-20E,Selective,Maintenance Services for Plumbing and Drainage Systems,"Chun Tat Trading (Air-Conditioning) Engineering Co., Ltd.Flat G, 12/F, Summit Building30 Man Yue StreetHung Hom, KowloonHong Kong",Not Applicable,"HK$10,715,600",4 Sep 2020,MTR_Tender_Sep20_table1.csv,2020,Sep20,https://www.mtr.com.hk/en/corporate/tenders/Sep20.html
Q065362,Selective,Replacement of PLC for 33kV Auto-changeover and Interlocking System,"Siemens Mobility LimitedUnits 905-907, 9/F, Tower B,Manulife Financial Centre,223-231 Wai Yip StreetKwun Tong, KowloonHong Kong",1 Job,"HK$3,999,888",25 Sep 2020,MTR_Tender_Sep20_table1.csv,2020,Sep20,https://www.mtr.com.hk/en/corporate/tenders/Sep20.html
Q068433,Selective,Supply of Forged Monobloc Wheels for MTR Passenger Trains (Package 1),"Construcciones Y Auxiliar De Ferrocarriles, S. A.J. M. Iturrioz 2620200 Beasain, GipuzkoaSpain",1 Job,"HK$92,960,157.92",30 Sep 2020,MTR_Tender_Sep20_table1.csv,2020,Sep20,https://www.mtr.com.hk/en/corporate/tenders/Sep20.html
Q074897,Selective,Provision of Office Supplies Through e-Procurement Solution,"bigboXX.com Limited1/F, No. 7-13 Kwai Tak StreetKwai Chung, New TerritoriesHong Kong",3 Years,"HK$85,000,000",11 Sep 2020,MTR_Tender_Sep20_table1.csv,2020,Sep20,https://www.mtr.com.hk/en/corporate/tenders/Sep20.html
Q075240,Selective,"Supply of Fuel Oil (Packaged 200L Diesel, 18L Petrol & Kerosene)","Tak Cheong Loong Petroleum Chemicals LimitedUnit H-1, 3/FOn Ho Industrial Building17-19 Shing Wan RoadShatin, New TerritoriesHong Kong",3 Years,"HK$4,645,300",17 Sep 2020,MTR_Tender_Sep20_table1.csv,2020,Sep20,https://www.mtr.com.hk/en/corporate/tenders/Sep20.html
Q075751,Selective,Provision of Comprehensive Maintenance Services for Lifts and Escalators at Elements,"ThyssenKrupp Elevator (HK) Ltd31/F, Enterprise Square ThreeNo. 39 Wang Chiu RoadKowloon Bay, KowloonHong Kong",1 Job,Not Disclosed,2 Sep 2020,MTR_Tender_Sep20_table1.csv,2020,Sep20,https://www.mtr.com.hk/en/corporate/tenders/Sep20.html
11279,Selective,Additional Works of AMO Cabinet System at SUW,"Palgo Company LimitedFlat 1, 3/F,Yee Kuk Industrial Centre555 Yee Kuk StreetCheung Sha Wan, KowloonHong Kong",Not Applicable,"HK$646,640",31 Aug 2020,MTR_Tender_Aug20_table1.csv,2020,Aug20,https://www.mtr.com.hk/en/corporate/tenders/Aug20.html
Q073877,Selective,"Provision of Periodic Inspection, Testing and Certification for Low Voltage Fixed Installations at MTR Stations and Ancillary Buildings","Best Engineering Services LimitedUnit E, 10/FOn Wah Industrial BuildingNo. 41-43 Au Pui Wan StreetFotan, Shatin, New TerritoriesHong Kong",5 Years,"HK$13,858,000",24 Aug 2020,MTR_Tender_Aug20_table1.csv,2020,Aug20,https://www.mtr.com.hk/en/corporate/tenders/Aug20.html
Q076765,Selective,Provision of Laundry and Dry Cleaning Services for Property Division,"Quality Laundry Limited11/F, International Industrial BuildingNo. 175 Hoi Bun RoadKwun Tong, KowloonHong Kong",3 Years,Not Disclosed,28 Aug 2020,MTR_Tender_Aug20_table1.csv,2020,Aug20,https://www.mtr.com.hk/en/corporate/tenders/Aug20.html
T0960-20C,Selective,Term Contract for Provision of Scaffolding,"Shui On Building Contrators Limited34/F, Shui On Centre6-8 Harbour RoadWanchaiHong Kong",Not Applicable,Not Disclosed,26 Aug 2020,MTR_Tender_Aug20_table1.csv,2020,Aug20,https://www.mtr.com.hk/en/corporate/tenders/Aug20.html
M1198-19E,Selective,Maintenance Services for Fire Services and Automatic Fire Alarm Systems,"Link-Foong Engineering Services LimitedFlat 11, 2/FNew Port Centre, Phase II116 Ma Tau Kok RoadTokwawan, KowloonHong Kong",Not Applicable,"HK$36,215,544",28 Apr 2020,MTR_Tender_Apr20_table1.csv,2020,Apr20,https://www.mtr.com.hk/en/corporate/tenders/Apr20.html
M1202-19E,Selective,Maintenance Services for Central ECS Plants,"REC Engineering Company LimitedUnits A-D, 15/FGoodman Kwai Chung Logistics Centre585-609 Castle Peak RoadKwai Chung, New TerritoriesHong Kong",Not Applicable,"HK$78,333,000",28 Apr 2020,MTR_Tender_Apr20_table1.csv,2020,Apr20,https://www.mtr.com.hk/en/corporate/tenders/Apr20.html
Q070868,Selective,Supply of 5.5 Ton Lorries,"Crown Motor LtdG/F, Goodluck Industrial Centre808 Lai Chi Kok RoadKowloonHong Kong",2 Units,"HK$869,868",27 Apr 2020,MTR_Tender_Apr20_table1.csv,2020,Apr20,https://www.mtr.com.hk/en/corporate/tenders/Apr20.html
Q073852,Selective,Provision of Contractor Safety Audit Service for Operations Division,"SGS Hong Kong LtdUnit 303 & 305, 3/FBuilding 22E Phase 3Hong Kong Science ParkPak Shek Kok, New TerritoriesHong Kong",2 Years,"HK$3,936,000",01 Apr 2020,MTR_Tender_Apr20_table1.csv,2020,Apr20,https://www.mtr.com.hk/en/corporate/tenders/Apr20.html
Q075281,Selective,Term Contract for IT Professionals,"Global Talent Services LimitedSuite G, 20/F, Seabright Plaza9-23 Shell StreetNorth PointHong Kong",1 Job,"HK$7,057,777.77",17 Apr 2020,MTR_Tender_Apr20_table1.csv,2020,Apr20,https://www.mtr.com.hk/en/corporate/tenders/Apr20.html
T0959-20C,Selective,Term Contract for Architectural and Building Works,"Shui On Building Contractors Limited34/F, Shui On Centre6-8 Harbour RoadWanchaiHong Kong",Not Applicable,Not Applicable,07 Apr 2020,MTR_Tender_Apr20_table1.csv,2020,Apr20,https://www.mtr.com.hk/en/corporate/tenders/Apr20.html
C2318-19E,Selective,"Replacement of High Voltage and Low Voltage Systems for KTL, TWL and ISL","EEB-GTECH Joint VentureRoom 2403-08, 24/FCC Wu Building302-308 Hennessy RoadWanchaiHong Kong",Not Applicable,"HK$3,032,260,000",16 Mar 2020,MTR_Tender_Mar20_table1.csv,2020,Mar20,https://www.mtr.com.hk/en/corporate/tenders/Mar20.html
Q068026,Selective,Provision of Credit Card Payment Solution in Operation Railway,Bank of China (Hong Kong) LimitedBank of China Tower1 Garden RoadCentralHong Kong,5 Years,Not Disclosed,30 Mar 2020,MTR_Tender_Mar20_table1.csv,2020,Mar20,https://www.mtr.com.hk/en/corporate/tenders/Mar20.html
Q069467,Selective,Train Roof CCTV System for Pantograph and Overhead Line Condition Monitoring,"NEC Hong Kong Limited25/F, The Metropolis Tower10 Metropolis DriveHunghom, KowloonHong Kong",1 Job,"HK$8,954,038",11 Mar 2020,MTR_Tender_Mar20_table1.csv,2020,Mar20,https://www.mtr.com.hk/en/corporate/tenders/Mar20.html
Q070158,Selective,Provision of Additional Multi-Purpose Spaces for TCL Trains,"KML Engineering LimitedB12, G/F, Shatin Industrial CentreSiu Lek Yuen RoadShatin, New TerritoriesHong Kong",Not Applicable,"HK$2,400,000",02 Mar 2020,MTR_Tender_Mar20_table1.csv,2020,Mar20,https://www.mtr.com.hk/en/corporate/tenders/Mar20.html
Q074241,Selective,"Supply, Installation and Delivery of Steel Furniture","Novo Workstyle HK Ltd3/F, Cheung Lee Industrial Building9 Cheung Lee StreetChai WanHong Kong",1 Job,"HK$5,078,955",17 Mar 2020,MTR_Tender_Mar20_table1.csv,2020,Mar20,https://www.mtr.com.hk/en/corporate/tenders/Mar20.html
T0958-19C,Selective,Term Contract for Civil Engineering Works,"Shun Yuen Construction Co LtdOffice 1, 6/FRykadan Capital Tower135 Hoi Bun RoadKwun Tong, KowloonHong Kong",Not Applicable,Not Applicable,16 Mar 2020,MTR_Tender_Mar20_table1.csv,2020,Mar20,https://www.mtr.com.hk/en/corporate/tenders/Mar20.html
Q066537,Limited*,C2129 & C8087 - Provision of SACEM Trackside and Train-borne Equipment Spares in AEL & TCL,"ALSTOM Hong Kong LimitedUnit 1011, 10/F, New Kowloon Plaza38 Tai Kok Tsui RoadTai Kok Tsui, KowloonHong Kong",18 Items,"HK$11,508,059.74",28 Feb 2020,MTR_Tender_Feb20_table1.csv,2020,Feb20,https://www.mtr.com.hk/en/corporate/tenders/Feb20.html
Q068431,Selective,Supply of an Aerial Work Platform-mounted Wagon,"Tekway Engineering & Consulting Company LimitedUnit 701, 7/F, Tower 2, Silvercord30 Canton RoadTsimshatsui, KowloonHong Kong",1 Unit,"HK$6,797,069.40",24 Feb 2020,MTR_Tender_Feb20_table1.csv,2020,Feb20,https://www.mtr.com.hk/en/corporate/tenders/Feb20.html
Q069922,Selective,Provision of Building Design Support & Building Information Modeling Services,"ZST Corporation Ltd.909 QingAn Aviation Building4th Road Bagua, Futian DistrictShenzhen, Guangdong Province518029, China",2 Years,"HK$8,289,168",28 Feb 2020,MTR_Tender_Feb20_table1.csv,2020,Feb20,https://www.mtr.com.hk/en/corporate/tenders/Feb20.html
Q070595,Selective,Maintenance Services for MVAC System at Elements,"Raft (E&M) Engineering LimitedUnit 2101, 21/F, Chai Wan Industrial City, Phase 270 Wing Tai Road, Chai WanHong Kong",3 Years,"HK$9,500,400",26 Feb 2020,MTR_Tender_Feb20_table1.csv,2020,Feb20,https://www.mtr.com.hk/en/corporate/tenders/Feb20.html
Q070616,Selective,Provision of Recruitment Advertising Services,"Wilson Advertising Agency7/F, O.T.B. Building259-265 Des Voeux Road CentralHong Kong",3 Years,"HK$9,900,000",07 Feb 2020,MTR_Tender_Feb20_table1.csv,2020,Feb20,https://www.mtr.com.hk/en/corporate/tenders/Feb20.html
Q072293,Selective,Provision of Global Freight Forwarding Services,"TNT Express Worldwide (HK) Ltd27/F, Nanyang Plaza57 Hung To RoadKwun Tong, KowloonHong Kong",1 Job,"HK$2,552,604.88",27 Feb 2020,MTR_Tender_Feb20_table1.csv,2020,Feb20,https://www.mtr.com.hk/en/corporate/tenders/Feb20.html
Q072372,Selective,Provision of Asset Valuation for Properties,"Colliers International (Hong Kong) LimitedSuite 5701, Central Plaza18 Harbour RoadWanchaiHong Kong",1 Job,"HK$1,074,000",28 Feb 2020,MTR_Tender_Feb20_table1.csv,2020,Feb20,https://www.mtr.com.hk/en/corporate/tenders/Feb20.html
K1403-19E,Selective,"Escalator Refurbishment at EAL, TCL, KTL and ISL","Otis Elevator Company (H.K.) Limited12/F, Goldin Financial Global Centre17 Kai Cheung RoadKowloon Bay, KowloonHong Kong",Not Applicable,"HK$331,889,864.8",09 Jan 2020,MTR_Tender_Jan20_table1.csv,2020,Jan20,https://www.mtr.com.hk/en/corporate/tenders/Jan20.html
