Reference No.,Tendering Procedure,Title or Scope,Contractor(s) and Address(es),Item/Quantity,Awarded Amount,Date Awarded,Source_File,Year,Source_Month,Source_URL
1832B,Selective,Procurement of Overhead Line Equipment and Wires for Overlap Relocation for TML Protection Works near EAP25,"China Railway Electrification Engineering Group Co., Ltd.D5-D6A, 15/F, TML Tower3 Hoi Shing RoadTsuen Wan, New TerritoriesHong Kong",1 Job,"HK$7,699,800",27 Feb 2023,MTR_Tender_Feb23_table1.csv,2023,Feb23,https://www.mtr.com.hk/en/corporate/tenders/Feb23.html
Q092668,Open,"C8826 & K2984 - Provision of Battery Monitoring System in DUAT, TML & EAL","ATAL Data Centre Infrastructure Limited13/F, Island Place Tower,510 King’s Road,North PointHong Kong",1 Job,"HK$5,171,440",2 Feb 2023,MTR_Tender_Feb23_table1.csv,2023,Feb23,https://www.mtr.com.hk/en/corporate/tenders/Feb23.html
Q092893,Selective,Provision of Consultancy Services for Energy Audit for Investment Properties,"BeeXergy Consulting LimitedUnit 2001-05, APEC Plaza49 Hoi Yuen RoadKwun Tong, KowloonHong Kong",2 Years,"HK$890,000",23 Feb 2023,MTR_Tender_Feb23_table1.csv,2023,Feb23,https://www.mtr.com.hk/en/corporate/tenders/Feb23.html
Q094031,Selective,Provision of News and Infotainment at In-train LED Panel on MTR Trains,"Hong Kong Commercial Broadcasting Co., Ltd.3 Broadcast DriveKowloon Tong, KowloonHong Kong",1 Job,Not Disclosed,23 Feb 2023,MTR_Tender_Feb23_table1.csv,2023,Feb23,https://www.mtr.com.hk/en/corporate/tenders/Feb23.html
Q085450,Open,iERP (Finance & Supply Chain Management ERP System) Implementation Project,"Ernst & Young Advisory Services Ltd.27/F, One Taikoo Place979 King's RoadQuarry BayHong Kong",1 Job,Not Disclosed,19 Jun 2023,MTR_Tender_Jun23_table1.csv,2023,Jun23,https://www.mtr.com.hk/en/corporate/tenders/Jun23.html
Q091038,Selective,Provision of additional Multi-purpose Spaces for SP trains on TML,"Kum Shing Engineering Company LimitedUnit 8, UG/F, Phase IINewport Centre116 Ma Tau Kok RoadTokwawan, KowloonHong Kong",1 Job,"HK$7,086,542",1 Jun 2023,MTR_Tender_Jun23_table1.csv,2023,Jun23,https://www.mtr.com.hk/en/corporate/tenders/Jun23.html
Q093303,Selective,C8141 Supply of Traction Battery for Battery Electric Locomotives,"Infinitier Co LtdRoom 601, Bupa Centre141 Connaught Road WestHong Kong",1 Job,"HK$12,998,600",5 Jun 2023,MTR_Tender_Jun23_table1.csv,2023,Jun23,https://www.mtr.com.hk/en/corporate/tenders/Jun23.html
Q093493,Selective,C8992 - Provision of Tunnel/Trackside Fibre for Operating Railway Systems,"Pilot Solutions Asia Ltd.Unit 7, 8/FNan Fung Commercial Centre19 Lam Lok StreetKowloon Bay, KowloonHong Kong",1 Job,"HK$4,200,000",5 Jun 2023,MTR_Tender_Jun23_table1.csv,2023,Jun23,https://www.mtr.com.hk/en/corporate/tenders/Jun23.html
Q095560,Selective,"Provision of Armoured Transportation Service, Cash Dumping Service and Ticket Processing Centre Service for MTR Operations","Guardforce Ltd.1/F, Guardforce Centre3 Hok Yuen Street EastHung Hom, KowloonHong Kong",2 Years,"HK$47,425,440.24",28 Jun 2023,MTR_Tender_Jun23_table1.csv,2023,Jun23,https://www.mtr.com.hk/en/corporate/tenders/Jun23.html
1252A,Limited*,Signalling Works for A&T and Lantau Projects (Onshore Works),"ALSTOM Hong Kong LimitedUnit 1011-12, 10/FNew Kowloon Plaza38 Tai Kok Tsui RoadKowloonHong Kong",Not Applicable,Not Disclosed,15 Mar 2023,MTR_Tender_Mar23_table1.csv,2023,Mar23,https://www.mtr.com.hk/en/corporate/tenders/Mar23.html
1252B,Limited*,Signalling Works for A&T and Lantau Projects (Offshore Works),ALSTOM Transport SA48 rue Albert DhalenneSaint-Ouen-sur-Seine93400 France,Not Applicable,Not Disclosed,15 Mar 2023,MTR_Tender_Mar23_table1.csv,2023,Mar23,https://www.mtr.com.hk/en/corporate/tenders/Mar23.html
C3865.01-22E,Selective,Provision of eRFL System in Heavy Rail Lines,"Pilot Solutions Asia LimitedUnit 07, 8/FNan Fung Commerical CentreNo. 19 Lam Lok StreetKowloon Bay, KowloonHong Kong",Not Applicable,"HK$16,150,500",27 Mar 2023,MTR_Tender_Mar23_table1.csv,2023,Mar23,https://www.mtr.com.hk/en/corporate/tenders/Mar23.html
C8490-21E,Selective,Provision of Operations Cloud Platform for MTR Network - Phase 1,"PCCW Technical Services LimitedLevel 1, The Long Beach Commercial Podium8 Hoi Fai RoadTai Kok Tsui, KowloonHong Kong",Not Applicable,"HK$33,662,552.38",9 Mar 2023,MTR_Tender_Mar23_table1.csv,2023,Mar23,https://www.mtr.com.hk/en/corporate/tenders/Mar23.html
M1179-18E,Selective,Maintenance Services for DCS (Phase 3),"Huawei International Co. Limited26/F, Tower 6, The GatewayNo. 9 Canton RoadTsim Sha Tsui, KowloonHong Kong",Not Applicable,"HK$11,632,300",23 Mar 2023,MTR_Tender_Mar23_table1.csv,2023,Mar23,https://www.mtr.com.hk/en/corporate/tenders/Mar23.html
M1252-22C,Selective,Maintenance Services for Trackside Advertising Panels,"Kum Shing Engineering Company LimitedUG8, Phase IINewport Centre116 Ma Tau Kok RoadTokwawan, KowloonHong Kong",Not Applicable,"HK$46,140,491",7 Mar 2023,MTR_Tender_Mar23_table1.csv,2023,Mar23,https://www.mtr.com.hk/en/corporate/tenders/Mar23.html
Q089978,Selective,K2036 - Replacement of Crane Wagon M005 for LRL,"Tekway Engineering & Consulting Company LimitedUnit 701, 7/F, Tower 2Silvercord30 Canton RoadTsimshatsui, KowloonHong Kong",1 Job,"HK$11,447,092.7",29 Mar 2023,MTR_Tender_Mar23_table1.csv,2023,Mar23,https://www.mtr.com.hk/en/corporate/tenders/Mar23.html
Q092529,Selective,Operation and Management of Hung Hom Station Carpark,"Imperial Parking (Hong Kong) LimitedRoom 3113-16, 31/FMetroplaza Tower 1223 Hing Fong RoadKwai Fong, New TerritoriesHong Kong",1 Job,Not Disclosed,13 Mar 2023,MTR_Tender_Mar23_table1.csv,2023,Mar23,https://www.mtr.com.hk/en/corporate/tenders/Mar23.html
Q093193,Selective,Provision of Leakage Current Sensor for Platform Screen Door and Automatic Platform Gate,"Wintech Telecommunication Services LimitedUnit V, 4/FEverest Industrial Centre396 Kwun Tong RoadKwun Tong, KowloonHong Kong",1 Job,"HK$4,847,591",1 Mar 2023,MTR_Tender_Mar23_table1.csv,2023,Mar23,https://www.mtr.com.hk/en/corporate/tenders/Mar23.html
1601,Open,Kwu Tung Station on East Rail Line,"Dragages Hong Kong Limited3/F, Island Place Tower510 King's RoadNorth PointHong Kong",Not Applicable,"HK$2,045,616,888",8 Sep 2023,MTR_Tender_Sep23_table1.csv,2023,Sep23,https://www.mtr.com.hk/en/corporate/tenders/Sep23.html
1652,Limited*,Signalling System for KTU(EAL),"Siemens Mobility LimitedUnits 905-907, 9/F, Tower BManulife Financial Centre223-231 Wai Yip StreetKwun Tong, KowloonHong Kong",Not Applicable,Not Disclosed,20 Sep 2023,MTR_Tender_Sep23_table1.csv,2023,Sep23,https://www.mtr.com.hk/en/corporate/tenders/Sep23.html
C9321-23C,Selective,Civil and E&M Works for Replacement of Passenger Lifts (Batch 3A),"Mepork Engineering Services Limited19/F, China Overseas Building139 Hennessy RoadWanchaiHong Kong",1 Job,"HK$35,468,350",21 Sep 2023,MTR_Tender_Sep23_table1.csv,2023,Sep23,https://www.mtr.com.hk/en/corporate/tenders/Sep23.html
K2489-23E,Selective,Procurement of 35 Double-decker Electric Buses,"Alexander Dennis (Asia Pacific) LimitedUnit A-B, 9/F, YHC Tower1 Sheung Yuet RoadKowloon Bay, KowloonHong Kong",35 No.,"HK$184,318,173",4 Sep 2023,MTR_Tender_Sep23_table1.csv,2023,Sep23,https://www.mtr.com.hk/en/corporate/tenders/Sep23.html
Q093622,Selective,K3507 - Partial Replacement of Hong Kong Police Force Radio Amplifier System for EAL & TML,"Shun Hing Systems Integration Company Limited16/F, Shun Hing Centre2 Shing Yiu StreetKwai Chung, New TerritoriesHong Kong",1 Job,"HK$4,339,300",11 Sep 2023,MTR_Tender_Sep23_table1.csv,2023,Sep23,https://www.mtr.com.hk/en/corporate/tenders/Sep23.html
Q095335 (A),Selective,Term Contract for General Building Repair and Shop Repartitioning Works for Investment Properties  (Package A),"Jetline Construction Co., Limited1/F, Kiu Yin Commercial Building361-363 Lockhart RoadWanchaiHong Kong",1 Job,Not Disclosed,22 Sep 2023,MTR_Tender_Sep23_table1.csv,2023,Sep23,https://www.mtr.com.hk/en/corporate/tenders/Sep23.html
Q097777,Selective,Maintenance Service for the Fallen Object Detection System in East Rail Line,"Pilot Solutions Asia LimitedUnit 7, 8/FNan Fung Commercial Centre19 Lam Lok StreetKowloon Bay, KowloonHong Kong",2 Years,"HK$4,996,000",27 Sep 2023,MTR_Tender_Sep23_table1.csv,2023,Sep23,https://www.mtr.com.hk/en/corporate/tenders/Sep23.html
1201,Open,Tung Chung West Station and Tunnels,"Bouygues - Dragages (1201) Joint Venture3/F, Island Place Tower510 King's RoadNorth PointHong Kong",Not Applicable,"HK$4,153,586,888",15 May 2023,MTR_Tender_May23_table1.csv,2023,May23,https://www.mtr.com.hk/en/corporate/tenders/May23.html
1202,Open,Tung Chung East Station and Associated Enabling Works for Track Diversions,"Paul Y. - CRCC (TUE1202) Joint Venture11/F, Paul Y Centre51 Hung To Road,Kwun Tong, KowloonHong Kong",Not Applicable,"HK$2,049,026,800",15 May 2023,MTR_Tender_May23_table1.csv,2023,May23,https://www.mtr.com.hk/en/corporate/tenders/May23.html
C9517.A2-23C,Selective,Civil & Structural Works for Tseung Kwan O Depot (TKD) Phase 2 Area,"Penta-Ocean Construction Co., LtdUnit 601, K. Wah Centre191 Java RoadNorth PointHong Kong",1 Job,"HK$63,500,000",4 May 2023,MTR_Tender_May23_table1.csv,2023,May23,https://www.mtr.com.hk/en/corporate/tenders/May23.html
C9517.B-23E,Selective,E&M Provisions for Tseung Kwan O Depot (TKD) Phase 2 Area,"Shinryo Technical Services LimitedUnit 1805Wang Lung Industrial BuildingNo. 11 Lung Tak StreetTsuen Wan, New TerritoriesHong Kong",1 Job,"HK$106,500,000",4 May 2023,MTR_Tender_May23_table1.csv,2023,May23,https://www.mtr.com.hk/en/corporate/tenders/May23.html
K3756-22E,Limited*,Replacement of AzLM ACE Axle Counter System in PHD-W,"Ground Transportation Systems (Hong Kong) LimitedUnit 912, New Kowloon Plaza38 Tai Kok Tsui RoadKowloonHong Kong",1 Job,"HK$149,532,881.6",5 May 2023,MTR_Tender_May23_table1.csv,2023,May23,https://www.mtr.com.hk/en/corporate/tenders/May23.html
Q094309,Selective,"Provision of Smart PadLock System for AEL, TCL, DRL and EAL","Kum Shing Engineering Company LimitedUG/F, Unit 8Newport Centre Phase II116 Ma Tau Kok RoadKowloonHong Kong",1 Job,"HK$5,898,420",5 May 2023,MTR_Tender_May23_table1.csv,2023,May23,https://www.mtr.com.hk/en/corporate/tenders/May23.html
Q096958,Selective,"Sale of Used Rails, Wheels and the Associated Miscellaneous Items","Lee Yuen Hong LimitedRoom B, 18/FWing Sing Commercial Centre12 Wing Lok StreetSheung WanHong Kong",1 Year,Not Disclosed,16 May 2023,MTR_Tender_May23_table1.csv,2023,May23,https://www.mtr.com.hk/en/corporate/tenders/May23.html
1220,Open,Trackwork and Overhead Line for Tung Chung Line Extension,"CRCC - Paul Y. (TUE 1220) Joint VentureUnit A, 10/FMG Tower133 Hoi Bun RoadKwun Tong, KowloonHong Kong",Not Applicable,"HK$374,880,000",11 Dec 2023,MTR_Tender_Dec23_table1.csv,2023,Dec23,https://www.mtr.com.hk/en/corporate/tenders/Dec23.html
1500 (combined with Contracts 1501 and 1502),Open,"TME Stations, Viaducts and River Crossing","CRBC-Build King Joint Venture38/F, Dorset HouseTaikoo Place979 King's RoadQuarry BayHong Kong",Not Applicable,"HK$6,220,587,500",13 Dec 2023,MTR_Tender_Dec23_table1.csv,2023,Dec23,https://www.mtr.com.hk/en/corporate/tenders/Dec23.html
1701,Open,Oyster Bay Station and Associated Works,"China State Construction Engineering (Hong Kong) Limited29/F, China Overseas Building139 Hennessy RoadWan ChaiHong Kong",Not Applicable,"HK$8,466,000,000",6 Dec 2023,MTR_Tender_Dec23_table1.csv,2023,Dec23,https://www.mtr.com.hk/en/corporate/tenders/Dec23.html
M1268-23,Selective,Cleaning Services for Operating Railway,"Winson Cleaning Service Co LtdUnit 1926, 19/F, Global Plaza1 Sha Tsui RoadTsuen Wan, New TerritoriesHong Kong",Not Applicable,"HK$659,738,678",8 Dec 2023,MTR_Tender_Dec23_table1.csv,2023,Dec23,https://www.mtr.com.hk/en/corporate/tenders/Dec23.html
Q097890,Selective,Provision of Gate-Top PIDS for Strategic Stations in Heavy Rail Line,"Advance System (Asia) LimitedRoom 901, 9/FInternational Plaza20 Sheung Yuet RoadKowloon Bay, KowloonHong Kong",1 Job,"HK$4,346,600",21 Dec 2023,MTR_Tender_Dec23_table1.csv,2023,Dec23,https://www.mtr.com.hk/en/corporate/tenders/Dec23.html
Q098496,Selective,Supply of 5.5 Ton Diesel Lorries,"Crown Motors Ltd.G/F, Goodluck Industrial Centre808 Lai Chi Kok RoadCheung Sha Wan, KowloonHong Kong",5 Nos.,"HK$2,582,657.5",13 Dec 2023,MTR_Tender_Dec23_table1.csv,2023,Dec23,https://www.mtr.com.hk/en/corporate/tenders/Dec23.html
Q099804,Selective,Provision of Safety and Hygiene Audit and Inspection Services for MTR Malls,"Industrial Technology Consultants LimitedRoom 1105, 11/FKnutsford Commercial Building4 Knutsford TerraceTsimshatsui, KowloonHong Kong",1 Job,Not Disclosed,6 Dec 2023,MTR_Tender_Dec23_table1.csv,2023,Dec23,https://www.mtr.com.hk/en/corporate/tenders/Dec23.html
C5610-22E (A),Selective,Replacement of Escalators,"TK Elevator Hong Kong Limited31/F Enterprise Square ThreeNo. 39 Wang Chiu RoadKowloon Bay, KowloonHong Kong",10 No.,"HK$45,123,198",6 Apr 2023,MTR_Tender_Apr23_table1.csv,2023,Apr23,https://www.mtr.com.hk/en/corporate/tenders/Apr23.html
C5610-22E (B),Selective,Replacement of Escalators,Schindler Lifts (Hong Kong) Limited29/F Devon House979 King’s RoadQuarry BayHong Kong,11 No.,"HK$62,725,740",6 Apr 2023,MTR_Tender_Apr23_table1.csv,2023,Apr23,https://www.mtr.com.hk/en/corporate/tenders/Apr23.html
Q093855,Selective,Term Contract for Provision of Event Management and Production Services for MTR Projects Events,"Pico International (HK) LimitedPico House4 Dai Fu StreetTai Po Industrial EstateTai Po, New TerritoriesHong Kong",1 Job,Not Disclosed,27 Apr 2023,MTR_Tender_Apr23_table1.csv,2023,Apr23,https://www.mtr.com.hk/en/corporate/tenders/Apr23.html
CT149-21E,Open,Provision of DCS Network for 5G Services,"China Mobile Hong Kong Co. Ltd.L20, Tower 1Kowloon Commerce Centre51 Kwai Cheong RoadKwai Chung, New TerritoriesHong Kong",1 Job,"HK$185,752,000",26 Jul 2023,MTR_Tender_Jul23_table1.csv,2023,Jul23,https://www.mtr.com.hk/en/corporate/tenders/Jul23.html
Q094955,Selective,Advertising Sales Agency Service for MTR Operating Railway (Package A & C),"JCDecaux Pearl & Dean Limited20/F, Berkshire HouseTaikoo Place25 Westlands RoadQuarry BayHong Kong",5 Years,"HK$4,475,000,000",7 Jul 2023,MTR_Tender_Jul23_table1.csv,2023,Jul23,https://www.mtr.com.hk/en/corporate/tenders/Jul23.html
Q095175,Selective,Refurbishment of 11kV Service Transformers in AT&D (Phase 1),"Key Direction Limited21/F, ADP Pentagon Centre98 Texaco RoadTsuen Wan, New TerritoriesHong Kong",1 Job,"HK$9,929,888",12 Jul 2023,MTR_Tender_Jul23_table1.csv,2023,Jul23,https://www.mtr.com.hk/en/corporate/tenders/Jul23.html
Q095559,Selective,Provision of Customer Services for Customer Service Centre (CuC) function for 29 MTR Stations,"Vpower Finance Security (Hong Kong) LimitedUnit 703, 7/FGoodman Global Gateway168 Yeung Uk RoadTsuen Wan, New TerritoriesHong Kong",2 Years,"HK$95,652,792",11 Jul 2023,MTR_Tender_Jul23_table1.csv,2023,Jul23,https://www.mtr.com.hk/en/corporate/tenders/Jul23.html
Q095715,Selective,Supply of 41 Sets of Smart Safe for Customer Service Centre in Stations,"Vpower Finance Security (Hong Kong) LimitedUnit 703, 7/FGoodman Global Gateway168 Yeung Uk RoadTsuen Wan, New TerritoriesHong Kong",1 Job,"HK$3,985,240",12 Jul 2023,MTR_Tender_Jul23_table1.csv,2023,Jul23,https://www.mtr.com.hk/en/corporate/tenders/Jul23.html
Q096969,Selective,Provision of Agency Services for Corporate Travel,"Corporate Travel Management LimitedUnit 01, 18/FCDW Building388 Castle Peak RoadTsuen Wan, New TerritoriesHong Kong",2 Years,Not Disclosed,25 Jul 2023,MTR_Tender_Jul23_table1.csv,2023,Jul23,https://www.mtr.com.hk/en/corporate/tenders/Jul23.html
1831,Selective,Alteration and Addition Works for Tuen Ma Line Protection near EAP25,"Kum Shing (K.F.) Construction Company LimitedUG8, Newport Centre116 Ma Tau Kok RoadKowloonHong Kong",1 Job,"HK$96,762,647",9 Jan 2023,MTR_Tender_Jan23_table1.csv,2023,Jan23,https://www.mtr.com.hk/en/corporate/tenders/Jan23.html
Q094112,Selective,Provision of Maintenance Services and Consumables for Mosquito Traps for Managed Properties,"Innocorp LimitedRoom 126, 1/FGalaxy Factory BuildingNo. 25-27 Luk Hop StreetSan Po Kong, KowloonHong Kong",3 Years,Not Disclosed,20 Jan 2023,MTR_Tender_Jan23_table1.csv,2023,Jan23,https://www.mtr.com.hk/en/corporate/tenders/Jan23.html
1254,Open,Platform Screen Door and Automatic Platform Gate,"FD-EEB Joint VentureUnit D5-D6, 15/FTML Tower3 Hoi Shing RoadTsuen Wan, New TerritoriesHong Kong",Not Applicable,Not Disclosed,15 Nov 2023,MTR_Tender_Nov23_table1.csv,2023,Nov23,https://www.mtr.com.hk/en/corporate/tenders/Nov23.html
1653,Open,Tunnel Environmental Control System for KTU(EAL),"Gammon E&M Limited22/F, Tower 1, The Quayside77 Hoi Bun RoadKwun Tong, KowloonHong Kong",Not Applicable,"HK$168,759,000",8 Nov 2023,MTR_Tender_Nov23_table1.csv,2023,Nov23,https://www.mtr.com.hk/en/corporate/tenders/Nov23.html
Q098495,Selective,Supply of Diesel Vans,"Hyundai Hong Kong Co. LimitedShop 4D, G/F & Unit 14, 8/FNam Fung Commercial Centre19 Lam Lok StreetKowloon Bay, KowloonHong Kong",21 Units,"HK$6,641,767.3",20 Nov 2023,MTR_Tender_Nov23_table1.csv,2023,Nov23,https://www.mtr.com.hk/en/corporate/tenders/Nov23.html
Q098832,Selective,Provision of Sanitary and Hygiene Products for Managed & Investment Properties and Administration Department,"Watson Hygiene Services LimitedUnit 1807-1815, 18/FPeninsula Tower538 Castle Peak RoadCheung Sha Wan, KowloonHong Kong",3 Years,Not Disclosed,1 Nov 2023,MTR_Tender_Nov23_table1.csv,2023,Nov23,https://www.mtr.com.hk/en/corporate/tenders/Nov23.html
Q099678,Selective,Group Life Insurance for Employees 2024-2026,"AIA International LimitedSuite 1701, Manhattan Place23 Wang Tai RoadKowloon Bay, KowloonHong Kong",3 Years,Not Disclosed,15 Nov 2023,MTR_Tender_Nov23_table1.csv,2023,Nov23,https://www.mtr.com.hk/en/corporate/tenders/Nov23.html
Q100397,Selective,Charter of Launch Services,"Osea Marine Tour Company LimitedRoom 2206, 22/FYue Fai Commercial Centre208 Aberdeen Main RoadAberdeenHong Kong",3 Units,"HK$7,403,988",30 Nov 2023,MTR_Tender_Nov23_table1.csv,2023,Nov23,https://www.mtr.com.hk/en/corporate/tenders/Nov23.html
C7179-23C,Selective,Replacement of Trackside Advertising Panels on AT&D,"GTECH Services (Hong Kong) LimitedRoom 2403-08, 24/FCC Wu Building302-308 Hennessy RoadWanchaiHong Kong",1 Job,"HK$69,863,822",8 Aug 2023,MTR_Tender_Aug23_table1.csv,2023,Aug23,https://www.mtr.com.hk/en/corporate/tenders/Aug23.html
M1227-20E,Selective,"Maintenance Services of UTM at EAL, MOL, KTE, WIL and SIL","Roctec Technology LimitedRoom 1502-4, 15/FKodak House II321 Java RoadNorth PointHong Kong",1 Job,"HK$3,761,600",25 Aug 2023,MTR_Tender_Aug23_table1.csv,2023,Aug23,https://www.mtr.com.hk/en/corporate/tenders/Aug23.html
Q095921,Selective,Provision of China Social Media Services & Online Advertising Services for MTR Malls,"WeMine LimitedRoom D, 6/F, MG Tower133 Hoi Bun RoadKwun Tong, KowloonHong Kong",1 Year,Not Disclosed,31 Aug 2023,MTR_Tender_Aug23_table1.csv,2023,Aug23,https://www.mtr.com.hk/en/corporate/tenders/Aug23.html
Q096485,Selective,Provision of Laundry and Dry Cleaning Services for Managed and Investment Properties,"Sunshine Laundry Factory Company Limited5/F, Block ALee Sum Factory Building23 Sze Mei StreetSan Po Kong, KowloonHong Kong",3 Years,Not Disclosed,18 Aug 2023,MTR_Tender_Aug23_table1.csv,2023,Aug23,https://www.mtr.com.hk/en/corporate/tenders/Aug23.html
Q098208,Selective,Provision of Design and Printing Services for the Corporation,"Artel Design CompanyUnit 5, 14/FTreasure Centre42 Hung To RoadKwun Tong, KowloonHong Kong",1 Job,Not Disclosed,30 Aug 2023,MTR_Tender_Aug23_table1.csv,2023,Aug23,https://www.mtr.com.hk/en/corporate/tenders/Aug23.html
T0973-23E,Selective,Provision of Term Workers for Rolling Stock and Depot Works,"Hop Yuen Construction Company2/F, Hop Yuen Centre171 Queen's Road CentralHong Kong",1 Job,Not Disclosed,8 Aug 2023,MTR_Tender_Aug23_table1.csv,2023,Aug23,https://www.mtr.com.hk/en/corporate/tenders/Aug23.html
C7635-23E,Selective,"Replacement of High Voltage and Low Voltage Systems for TWL, ISL and TKL","EEB-GTECH Joint VentureRoom C1-C5, 29/F, TML Tower3 Hoi Shing RoadTsuen Wan, New TerritoriesHong Kong",Not Applicable,"HK$1,676,666,666",15 Mar 2024,MTR_Tender_Mar24_table1.csv,2024,Mar24,https://www.mtr.com.hk/en/corporate/tenders/Mar24.html
C9482-23C,Selective,"Replacement of Trackside Advertising Panels on KTL, TWL & ISL","GTECH Services (Hong Kong) LimitedRoom 2403-08, 24/FC C Wu Building302-308 Hennessy RoadWanchaiHong Kong",Not Applicable,"HK$56,280,000",7 Mar 2024,MTR_Tender_Mar24_table1.csv,2024,Mar24,https://www.mtr.com.hk/en/corporate/tenders/Mar24.html
C9554-23E,Selective,Replacement of Lighting with LED Technology,"Shimizu CorporationRoom 4313-4322Metroplaza Tower 1223 Hing Fong RoadKwai Fong, New TerritoriesHong Kong",Not Applicable,"HK$73,559,350.76",27 Mar 2024,MTR_Tender_Mar24_table1.csv,2024,Mar24,https://www.mtr.com.hk/en/corporate/tenders/Mar24.html
Q095471,Selective,Supply of an Aerial Work Platform-mounted Wagon,"Tekway Engineering & Consulting Company LimitedUnit 701, 7/F, Tower 2, Silvercord30 Canton RoadTsimshatsui, KowloonHong Kong",1 Job,"HK$7,185,245.1",14 Mar 2024,MTR_Tender_Mar24_table1.csv,2024,Mar24,https://www.mtr.com.hk/en/corporate/tenders/Mar24.html
Q098524,Selective,System Upgrade for Office Contactless Smart Card Processor Terminal (OCPT),"Diebold Nixdorf (Hong Kong) LimitedUnits 2506-10, 25/F, Tower 2Ever Gain Plaza88 Container Port RoadKwai Chung, New TerritoriesHong Kong",1 Job,"HK$5,377,500",26 Mar 2024,MTR_Tender_Mar24_table1.csv,2024,Mar24,https://www.mtr.com.hk/en/corporate/tenders/Mar24.html
Q102002,Selective,"Provision of Dismantle, Installation and Inventory & Logistic Management Services for System Furniture","Jet Consultant CompanyRoom 01, 20/FHoi Ying Court, Aberdeen Centre10 Nam Ning Street, AberdeenHong Kong",3 Years,"HK$7,717,370",6 Mar 2024,MTR_Tender_Mar24_table1.csv,2024,Mar24,https://www.mtr.com.hk/en/corporate/tenders/Mar24.html
1581,Limited*,Advance Works for Signalling System under Contract 1552,"Ground Transportation Systems (Hong Kong) LimitedUnit 912, 9/FNew Kowloon Plaza38 Tai Kok Tsui RoadKowloonHong Kong",Not Applicable,"HK$139,594,017",26 Jun 2024,MTR_Tender_Jun24_table1.csv,2024,Jun24,https://www.mtr.com.hk/en/corporate/tenders/Jun24.html
C3860-23E,Selective,Provision of In-Train TV System for New TCL & AEL Trains,"Roctec Technology LimitedRoom 1502-4, 15/FKodak House II321 Java RoadNorth PointHong Kong",Not Applicable,"HK$15,380,000",6 Jun 2024,MTR_Tender_Jun24_table1.csv,2024,Jun24,https://www.mtr.com.hk/en/corporate/tenders/Jun24.html
K1928.B-23E,Selective,Installation of Point Operating Equipment in LRL,"KML Engineering LimitedB12, G/FShatin Industrial CentreSiu Lek Yuen RoadShatin, New TerritoriesHong Kong",Not Applicable,"HK$1,571,000",17 Jun 2024,MTR_Tender_Jun24_table1.csv,2024,Jun24,https://www.mtr.com.hk/en/corporate/tenders/Jun24.html
M1283-24E,Selective,Maintenance Services for Signalling System in HSR,"Beijing HollySys Co., Ltd.No.2 Disheng Middle RoadBeijing Economic and Technological Development AreaChina",Not Applicable,"HK$407,768,793.28",19 Jun 2024,MTR_Tender_Jun24_table1.csv,2024,Jun24,https://www.mtr.com.hk/en/corporate/tenders/Jun24.html
Q095335 (C),Selective,Term Contract for General Building Repair and Shop Repartitioning Works for Investment Properties (Package C),"Kar Cheung Engineering CoFlat 07, 17/FKowloon Plaza485 Castle Peak RoadLai Chi Kok, KowloonHong Kong",3 Years,Not Disclosed,27 Jun 2024,MTR_Tender_Jun24_table1.csv,2024,Jun24,https://www.mtr.com.hk/en/corporate/tenders/Jun24.html
Q104493,Selective,Provision of Term Concierge Personnel for Two International Finance Centre,"KOS International LimitedSuite 610, 6/FOcean Centre5 Canton RoadTsim Sha Tsui, KowloonHong Kong",2 Years,Not Disclosed,20 Jun 2024,MTR_Tender_Jun24_table1.csv,2024,Jun24,https://www.mtr.com.hk/en/corporate/tenders/Jun24.html
T0974-24C,Selective,Term Contract for Architectural and Building Works,"Shui On Building Contractors Limited34/F, Shui On Centre6-8 Harbour RoadWanchaiHong Kong",Not Applicable,Not Disclosed,7 Jun 2024,MTR_Tender_Jun24_table1.csv,2024,Jun24,https://www.mtr.com.hk/en/corporate/tenders/Jun24.html
12051,Limited*,Supply of Octopus Readers / Writers and EMV Readers,"Octopus Transactions Limited46/F Manhattan Place23 Wang Tai RoadKowloon Bay, KowloonHong Kong",1 Job,Not Disclosed,26 Nov 2024,MTR_Tender_Nov24_table1.csv,2024,Nov24,https://www.mtr.com.hk/en/corporate/tenders/Nov24.html
A322-24E,Selective,Independent Safety Assessment for New Rolling Stock in Disneyland Resort Line,"TUV Rheinland Hong Kong Limited3-4/F, Fou Wah Industrial Building10-16 Pun Shan StreetTsuen Wan, New TerritoriesHong Kong",1 Job,"HK$4,527,000",14 Nov 2024,MTR_Tender_Nov24_table1.csv,2024,Nov24,https://www.mtr.com.hk/en/corporate/tenders/Nov24.html
A325-24E,Selective,Term Consultancy of Communications and Control Systems Design,"C K Leung & Associates Company LimitedRoom 1914-15, Gala Place56 Dundas StreetKowloonHong Kong",Not Applicable,Not Applicable,29 Nov 2024,MTR_Tender_Nov24_table1.csv,2024,Nov24,https://www.mtr.com.hk/en/corporate/tenders/Nov24.html
M1258-23E,Selective,Maintenance Services for Building Services System at TKL,"Shinryo Technical Services LimitedUnit 1805, 18/FWang Lung Industrial BuildingNo. 11 Lung Tak StreetTseun Wan, New TerritoriesHong Kong",1 Job,"HK$49,503,928",11 Nov 2024,MTR_Tender_Nov24_table1.csv,2024,Nov24,https://www.mtr.com.hk/en/corporate/tenders/Nov24.html
Q101962,Selective,Modification of Two Flat Wagons to Overhead Line Fixed Platform Wagons for TML,"Tekway Engineering & Consulting Company LimitedUnit 7-8, 3/FMetro Centre IINo 21 Lam Hing StreetKowloon Bay, KowloonHong Kong",1 Job,"HK$2,761,840",28 Nov 2024,MTR_Tender_Nov24_table1.csv,2024,Nov24,https://www.mtr.com.hk/en/corporate/tenders/Nov24.html
