Reference No.,Tendering Procedure,Title or Scope,Contractor(s) and Address(es),Item/Quantity,Awarded Amount,Date Awarded,Source_File,Year,Source_Month,Source_URL
Q043332,Selective,"Operation of Duty Free Business at Hung Hom, Lo Wu and Lok Ma Chau Stations","Anway LimitedUnit 816 – 823, 8th Floor, Trade Square, 681 Cheung Sha Wan Road, Kowloon, Hong Kong",5 Years,Not Disclosed,22 Nov 2016,MTR_Tender_Nov16_table1.csv,2016,Nov16,https://www.mtr.com.hk/en/corporate/tenders/Nov16.html
Q044533,Selective,Supply of LCD Panels for EAL MLR Trains,"Shun Hing Systems Integration Company Limited16/F, Shun Hing Centre, 8 Shing Yiu Street, Kwai Chung, N.T., Hong Kong",1 Lot,"HK$4,408,200",3 Nov 2016,MTR_Tender_Nov16_table1.csv,2016,Nov16,https://www.mtr.com.hk/en/corporate/tenders/Nov16.html
Q045961,Selective,Modification of C-Train Door Bottom Guide Assembly,"CRC (Hong Kong) International Corporation Limited11/F, AXA Centre, 151 Gloucester Road, Wanchai, Hong Kong",1 Job,"HK$6,275,600",15 Nov 2016,MTR_Tender_Nov16_table1.csv,2016,Nov16,https://www.mtr.com.hk/en/corporate/tenders/Nov16.html
Q046452,Selective,"Provision of Security Guarding Services for Sheung Shui, Lok Ma Chau, Lo Wu and East Tsim Sha Tsui Stations","Honway Security Limited22/F, Hong Kong Chinese Bank, Causeway Bay Centre, 42-44 Yee Wo Street, Causeway Bay, Hong Kong",28 Months,"HK$11,083,718",24 Nov 2016,MTR_Tender_Nov16_table1.csv,2016,Nov16,https://www.mtr.com.hk/en/corporate/tenders/Nov16.html
Q046485,Selective,Provision of Marketing and Event Management Services for MTR Malls,"Almond LimitedUnit D, 8/F, Ka Ming Court, 688-690 Castle Peak Road, Kowloon, Hong Kong",3 Years,Not Disclosed,1 Nov 2016,MTR_Tender_Nov16_table1.csv,2016,Nov16,https://www.mtr.com.hk/en/corporate/tenders/Nov16.html
Q046486,Selective,Provision of Design and Production of Decoration for MTR Malls,"Pico International (HK) LimitedPico House, 4 Dai Fu Street, Tai Po Industrial Estate, New TerritoriesHong Kong",3 Years,Not Disclosed,30 Nov 2016,MTR_Tender_Nov16_table1.csv,2016,Nov16,https://www.mtr.com.hk/en/corporate/tenders/Nov16.html
Q046933,Selective,Provision of Advertising Agency Services for Branding and Marketing Communications,"Cheil Hong Kong Limited2/F, 299 QRC, 299 Queen's Road Central, Sheung Wan, Hong Kong",2 Years,Not Disclosed,8 Nov 2016,MTR_Tender_Nov16_table1.csv,2016,Nov16,https://www.mtr.com.hk/en/corporate/tenders/Nov16.html
Q048464,Selective,Provision of Maintenance Services for Advertising Panels in MTR Stations,"Westwood LimitedUnit A1, G/F, Hi-Tech Industrial Centre, 5-21 Pak Tin Par Street, Tsuen Wan, New Territories, Hong Kong",2 Years,Not Disclosed,28 Nov 2016,MTR_Tender_Nov16_table1.csv,2016,Nov16,https://www.mtr.com.hk/en/corporate/tenders/Nov16.html
1191,Selective,Shatin to Central Link: Floodgate System for SCL Phase 2,"The Jardine Engineering Corporation, Limited5/F, Tower A, Manulife Financial Centre, 223-231 Wai Yip Street, Kwun Tong, Kowloon, Hong Kong",Not Applicable,"HK$60,259,267",8 Jan 2016,MTR_Tender_Jan16_table1.csv,2016,Jan16,https://www.mtr.com.hk/en/corporate/tenders/Jan16.html
1124,Selective,Shatin to Central Link: Admiralty SCL Related Works,"Leader - Kaden SCL1124 Joint VentureUnits 601-605A, 6/F, Tower B,Manulife Financial Centre,223 Wai Yip Street,Kwun Tong,Kowloon, Hong Kong",1 Job,"HK$833,606,000",10 Mar 2016,MTR_Tender_Mar16_table1.csv,2016,Mar16,https://www.mtr.com.hk/en/corporate/tenders/Mar16.html
Q036129,Selective,Supply of Gangway Bellows for Trains Operated in TCL and TKL,"Hubner Interface Systems (Shanghai) Co LtdBuilding 81,No. 90 Delin Road,Waigaoqiao Free Trade Zone,Shanghai 200131,China",1 Job,"HK$1,930,163",31 Mar 2016,MTR_Tender_Mar16_table1.csv,2016,Mar16,https://www.mtr.com.hk/en/corporate/tenders/Mar16.html
Q041784,Selective,Provision of Event Management and Production Services for MTR HONG KONG Race Walking,"Oval Design Ltd22D, Legend Tower,7 Shing Yip Street,Kwun Tong,Kowloon, Hong Kong",1 Year,Not disclosed,22 Mar 2016,MTR_Tender_Mar16_table1.csv,2016,Mar16,https://www.mtr.com.hk/en/corporate/tenders/Mar16.html
CT125-15E,Selective,DCS Network Replacement (Phase 1),"Huawei International Co Ltd9/F, Tower 6, The Gateway,9 Canton Road,Tsim Sha Tsui,Kowloon, Hong Kong",Not Applicable,"HK$64,853,974",12 Apr 2016,MTR_Tender_Apr16_table1.csv,2016,Apr16,https://www.mtr.com.hk/en/corporate/tenders/Apr16.html
Q040790,Selective,Supply of 5.5 Ton Diesel Lorries,"Universal Cars Ltd5/F, Sime Darby House,380 Castle Peak Road,Tsuen Wan,New Territories, Hong Kong",15 units,Not disclosed,13 Apr 2016,MTR_Tender_Apr16_table1.csv,2016,Apr16,https://www.mtr.com.hk/en/corporate/tenders/Apr16.html
Q040872,Selective,Ultrasonic Testing Vehicle,"Rail Technology International Pty Ltd9, Commercial Drive, Lynbrook,Victoria, 3975,Australia",1 Job,"HK$37,643,174",26 Apr 2016,MTR_Tender_Apr16_table1.csv,2016,Apr16,https://www.mtr.com.hk/en/corporate/tenders/Apr16.html
Q042776,Selective,Supply and Installation of Signage Materials for New Lines Opening,"Mountain Arts Production Co LtdFlat 1 & 9, 5/F, Sunray Industrial Centre,610C Cha Kwo Ling Road, Yau Tong Bay,Kowloon, Hong Kong",1 Job,"HK$970,448",27 Apr 2016,MTR_Tender_Apr16_table1.csv,2016,Apr16,https://www.mtr.com.hk/en/corporate/tenders/Apr16.html
C1496-15E,Limited,"Replacement of CVCM Track Circuits in ISL, KTL, TWL, TKL, AEL and TCL","ALSTOM Hong Kong LtdUnit 1011, 10/F, New Kowloon Plaza,38 Tai Kok Tsui Road,Tai Kok Tsui,Kowloon, Hong Kong",Not Applicable,"HK$242,628,690",5 Feb 2016,MTR_Tender_Feb16_table1.csv,2016,Feb16,https://www.mtr.com.hk/en/corporate/tenders/Feb16.html
K1572.A-15E,Selective,Upgrade of LCD In-Train TV System of IKK Trains (LCD Supply Package),"ITOCHU Hong Kong Ltd28/F, United Centre,95 Queensway,Hong Kong",Not Applicable,"HK$17,350,000",5 Feb 2016,MTR_Tender_Feb16_table1.csv,2016,Feb16,https://www.mtr.com.hk/en/corporate/tenders/Feb16.html
M1115-15E,Selective,Maintenance Services for AEL and TCL Data Network,"Roctec Technology LtdRoom 1502-4, 15/F, Kodak House II,321 Java Road,North Point,Hong Kong",Not Applicable,"HK$5,441,980",29 Feb 2016,MTR_Tender_Feb16_table1.csv,2016,Feb16,https://www.mtr.com.hk/en/corporate/tenders/Feb16.html
Q041798,Selective,Provision of Building Design Support & Building Information Modeling Services,"ZST Corporation LtdNo. 909, QingAn Aviation Building, 4th Road Bagua,Futian District,Shenzhen,China",2 Years,"HK$7,998,768",17 Feb 2016,MTR_Tender_Feb16_table1.csv,2016,Feb16,https://www.mtr.com.hk/en/corporate/tenders/Feb16.html
Q042124,Selective,"Shop Repartitioning Works at 1/F and 2/F, East Wing, Paradise Mall","Tong Kee Engineering LtdUnit P & Q, 11/F, Block 2, Kinho Industrial Building,14-24 Au Pui Wan Street,Fotan,Shatin,New Territories, Hong Kong",1 Job,"HK$45,827,840",25 Feb 2016,MTR_Tender_Feb16_table1.csv,2016,Feb16,https://www.mtr.com.hk/en/corporate/tenders/Feb16.html
Q042244,Selective,"Provision of Security Guarding Services for Wong Chuk Hang Depot, South Island Line Stations and Kwun Tong Line Extension Stations in 2016","International Wing Shing Security Management LtdRoom 1201-2, 12/F, Fee Tat Commercial Centre613 Nathan Road,Mong Kok,Kowloon, Hong Kong",1 Year,"HK$11,672,231",19 Feb 2016,MTR_Tender_Feb16_table1.csv,2016,Feb16,https://www.mtr.com.hk/en/corporate/tenders/Feb16.html
Q042709,Selective,Term Contracts for Provision of Consultancy Services for Interior Design and Drafting Services for MTR Malls,"Madison Asia LtdSuite 1501,Chinachem Leighton Plaza,29 Leighton Road,Causeway Bay,Hong Kong",3 Years,"HK$8,205,000",17 Feb 2016,MTR_Tender_Feb16_table1.csv,2016,Feb16,https://www.mtr.com.hk/en/corporate/tenders/Feb16.html
Q043333,Selective,Distribution of Free Daily Newspaper in MTR Stations,"Metro Daily Ltd12/F, KOHO,73-75 Hung To Road,Kwun Tong,Kowloon, Hong Kong",2 Years,Not Disclosed,12 Aug 2016,MTR_Tender_Aug16_table1.csv,2016,Aug16,https://www.mtr.com.hk/en/corporate/tenders/Aug16.html
Q044763,Selective,Elevated Road along LOHAS Park Road and the Pedestrian Footbridge FB1,"Hsin Chong Construction Company LimitedHsin Chong Center,107-109 Wai Yip Street,Kwun Tong,Hong Kong",Not Applicable,"HK$116,253,625",12 Aug 2016,MTR_Tender_Aug16_table1.csv,2016,Aug16,https://www.mtr.com.hk/en/corporate/tenders/Aug16.html
1154B,Selective,Shatin to Central Link: Platform Screen Doors for SCL Phase 2 & APG Retrofit of EAL,"Shenzhen Fangda Automatic System Co Ltd5/F, Fangda Building ,Keji South 12th Road,High-tech Industrial Park,Nanshan,Shenzhen,P.R. China",Not Applicable,"HK$511,666,066",16 May 2016,MTR_Tender_May16_table1.csv,2016,May16,https://www.mtr.com.hk/en/corporate/tenders/May16.html
1172B,Selective,Shatin to Central Link: Lifts and Escalators for SCL Phase 2,"Otis Elevator Co (H.K.) LtdSuites 1501-17, 1513-1516, 15/F, Cityplaza One,1111 King’s Road,Taikoo Shing,Hong Kong",Not Applicable,"HK$145,448,832",10 May 2016,MTR_Tender_May16_table1.csv,2016,May16,https://www.mtr.com.hk/en/corporate/tenders/May16.html
C6596-15E,Selective,"Escalator Refurbishment at ISL, KTL and TWL","Otis Elevator Co (H.K.) Ltd15/F, Cityplaza One,1111 King’s Road,Taikoo Shing,Hong Kong",Not Applicable,"HK$199,335,389",12 May 2016,MTR_Tender_May16_table1.csv,2016,May16,https://www.mtr.com.hk/en/corporate/tenders/May16.html
Q043435,Selective,Supply & Replacement of Chillers at Telford Plaza II,"The Jardine Engineering Corporation Ltd5/F, Tower A, Manulife Financial Centre, 223-231 Wai Yip Street, Kwun Tong,Kowloon, Hong Kong",1 Job,"HK$37,192,000",23 May 2016,MTR_Tender_May16_table1.csv,2016,May16,https://www.mtr.com.hk/en/corporate/tenders/May16.html
Q045024,Selective,Provision of MTR Station Shop Management Services,"Certis Centurion Facility Co LtdBlock D, 9/F, Ka Ming Court,688-690 Castle Peak Road,Lai Chi Kok,Kowloon, Hong Kong",2 Years,Not Disclosed,26 May 2016,MTR_Tender_May16_table1.csv,2016,May16,https://www.mtr.com.hk/en/corporate/tenders/May16.html
Q046233,Selective,Provision of Offset Printing Services,"Sea-Wan Colour Separation & Printing Co LtdFlat B, 4/F,29-31 Lee Chung Street,Hop Shi Factory Building,Chai Wan,Hong Kong",2 Years,Not Disclosed,17 May 2016,MTR_Tender_May16_table1.csv,2016,May16,https://www.mtr.com.hk/en/corporate/tenders/May16.html
K0838.B-15C,Selective,A&A Works at 2/F Arrival Concourse and G/F Departure Concourse at LOW,"P. D. (Contractors) LtdRoom 1205-06, New Kowloon Plaza,38 Tai Kok Tsui Road,Tai Kok Tsui,Kowloon, Hong Kong",Not Applicable,"HK$149,808,765",8 Jun 2016,MTR_Tender_Jun16_table1.csv,2016,Jun16,https://www.mtr.com.hk/en/corporate/tenders/Jun16.html
Q044438,Selective,Provision of Media Agency Services,"Optimum Media DirectionUnit 808, Core E, Cyberport 3,100 Cyberport Road, Pokfulam,Hong Kong",3 Years,Not Disclosed,1 Jun 2016,MTR_Tender_Jun16_table1.csv,2016,Jun16,https://www.mtr.com.hk/en/corporate/tenders/Jun16.html
8219,Selective,Design and Construction of Underfloor Wheel Lathe Shed and Associated Works at Shek Kong Stabling Sidings,"Pollard Construction Company LimitedUnit 4112, 41/F, One Midtown No. 11 Hoi Shing Road, Tsuen Wan, New Territories, Hong Kong",1 Job,"HK$12,041,325",18 May 2017,MTR_Tender_May17_table1.csv,2017,May17,https://www.mtr.com.hk/en/corporate/tenders/May17.html
C4988-16E,Selective,Replacement of CCTV Systems,"UniVision Engineering LtdRoom 01A, 2/F., Sunbeam Centre,27 Shing Yip Street,Kwun Tong, Kowloon, Hong Kong",Not Applicable,"HK$389,381,009",11 May 2017,MTR_Tender_May17_table1.csv,2017,May17,https://www.mtr.com.hk/en/corporate/tenders/May17.html
Q042694,Selective,Contact Wire Wear Measuring System,MER MEC S.p.A.Via Oberdan 70 70043 Monopoli (BA) Italy,1 Job,"HK$7,800,939",12 May 2017,MTR_Tender_May17_table1.csv,2017,May17,https://www.mtr.com.hk/en/corporate/tenders/May17.html
Q047631,Selective,Retrofit of Chillers in Plant Room A at Telford Plaza I,"The Jardine Engineering Corporation, Limited5/F, Tower A Manulife Financial Centre, 223-231 Wai Yip Street,Kwun Tong, KowloonHong Kong",1 Job,"HK$20,394,405",10 May 2017,MTR_Tender_May17_table1.csv,2017,May17,https://www.mtr.com.hk/en/corporate/tenders/May17.html
Q050853,Selective,Provision of Design and Production of Decoration for Elements,"Conceptual LimitedUnit 901-902, 9/F, Yen Sheng Centre, 64 Hoi Yuen Road, Kwun Tong, Hong Kong",Not Applicable,"HK$16,660,000",31 May 2017,MTR_Tender_May17_table1.csv,2017,May17,https://www.mtr.com.hk/en/corporate/tenders/May17.html
Q050854,Selective,Provision of Marketing and Event Management Services for Elements,"E’s Concept Communication Limited12/F, Greatmany Centre, 111 Queen’s Road East, Wan Chai, Hong Kong",Not Applicable,"HK$8,330,000",31 May 2017,MTR_Tender_May17_table1.csv,2017,May17,https://www.mtr.com.hk/en/corporate/tenders/May17.html
Q051224,Selective,Provision of Station Assistant Services for Various Projects in 2017 and 2018,"Synergis Management Services Limited8/F, KT336, 334-336 Kwun Tong Road, Kwun Tong, Kowloon, Hong Kong",2 Years,"HK$11,077,357",12 May 2017,MTR_Tender_May17_table1.csv,2017,May17,https://www.mtr.com.hk/en/corporate/tenders/May17.html
Q051261,Selective,Renovation at Paradise Mall (for Phase I),"KKP Construction LimitedRoom 202, Metro Centre 1,32 Lam Hing Street,Kowloon Bay, Hong Kong",1 Job,"HK$32,888,888",26 May 2017,MTR_Tender_May17_table1.csv,2017,May17,https://www.mtr.com.hk/en/corporate/tenders/May17.html
Q051845,Selective,Provision of News and Information at In-train LED Panel on MTR Trains,"Hong Kong Commercial Broadcasting Co., Ltd.3 Broadcast Drive, Kowloon, Hong Kong",3 Years,Not Disclosed,18 May 2017,MTR_Tender_May17_table1.csv,2017,May17,https://www.mtr.com.hk/en/corporate/tenders/May17.html
Q053277,Selective,Supply and Installation of Parking Guidance System for Elements,"Greatwood LimitedUnit J, 3/F, Block 2, Kwun Tong Industrial Centre, 460-470 Kwun Tong Road, Kwun Tong, Kowloon, Hong Kong",1 Job,Not Disclosed,18 May 2017,MTR_Tender_May17_table1.csv,2017,May17,https://www.mtr.com.hk/en/corporate/tenders/May17.html
8226,Selective,"Design, Supply and Installation of Fire Rated Enclosure at Day 2 Area","Build King Interior & Construction Ltd.Block Front, 4/F, Ming Sang Industrial Building, 19 Hing Yip Street, Kwun Tong, Hong Kong",1 Job,"HK$53,076,724",13 Oct 2017,MTR_Tender_Oct17_table1.csv,2017,Oct17,https://www.mtr.com.hk/en/corporate/tenders/Oct17.html
M1145-17C,Selective,Management and Maintenance Services for Lok Ma Chau and West Rail Wetlands,"Yee Sun Garden LimitedShop G903, G/F, Tung Hoi Mansion,8 Taikoo Shing Road,Taikoo Shing,Hong Kong",Not Applicable,"HK$11,021,660",25 Oct 2017,MTR_Tender_Oct17_table1.csv,2017,Oct17,https://www.mtr.com.hk/en/corporate/tenders/Oct17.html
Q051698,Selective,"Advertising Sales Agency Service for Kwun Tong Line, Tsuen Wan Line, Island Line, South Island Line, Tseung Kwan O Line, Tung Chung Line, Disneyland Resort Line and Airport Express","JCDecaux Pearl & Dean Limited14/F, Oxford House, Taikoo Place979 King’s Road, Quarry Bay,Hong Kong",3 Years,Not Disclosed,17 Oct 2017,MTR_Tender_Oct17_table1.csv,2017,Oct17,https://www.mtr.com.hk/en/corporate/tenders/Oct17.html
Q053425,Selective,Term Contracts for General Building Repair and Shop Repartitioning Works for Investment Properties (Package 1),"Tong Kee Engineering LimitedUnit P & Q, 11/F, Block 2, Kinho Industrial Building14-24 Au Pui Wan Street, Fotan, Shatin, New Territories, Hong Kong",3 years,"HK$44,000,000",31 Oct 2017,MTR_Tender_Oct17_table1.csv,2017,Oct17,https://www.mtr.com.hk/en/corporate/tenders/Oct17.html
Q054318,Selective,Provision of IT Application Management & Development Services,"Ai Pu Jing Software Technology (Hong Kong) Company Limited20/F, Xiu Ping Commercial Building, 104 Jervois Street, Sheung Wan, Hong Kong",Not Applicable,Not Disclosed,4 Oct 2017,MTR_Tender_Oct17_table1.csv,2017,Oct17,https://www.mtr.com.hk/en/corporate/tenders/Oct17.html
Q055128,Selective,Supply of Diesel Vans,"Honest Motors Ltd3 /F, DCH Building, 20 Kai Cheung Road, Kowloon Bay, Kowloon, Hong Kong",6 Months,Not Disclosed,30 Oct 2017,MTR_Tender_Oct17_table1.csv,2017,Oct17,https://www.mtr.com.hk/en/corporate/tenders/Oct17.html
Q053248,Open,Provision of Laundry and Dry Cleaning Service for Property Division,"Tingo Laundry & Dry Cleaning CompanyUnit I, 2/F, Block 2,Kwai Tak Industrial Centre,15-33 Kwai Tak Street,Kwai Chung, New Territories,Hong Kong",Not Applicable,"HK$3,911,211",25 Aug 2017,MTR_Tender_Aug17_table1.csv,2017,Aug17,https://www.mtr.com.hk/en/corporate/tenders/Aug17.html
Q054178,Selective,3-Year Term Contract for Tree Inspection Services for Property Division,"Wing Ho Yuen Landscaping Company LimitedLot 48RP, DD210, Pak Wai Village, Sai Kung, New Territories, Hong Kong",3 Years,Not Disclosed,31 Aug 2017,MTR_Tender_Aug17_table1.csv,2017,Aug17,https://www.mtr.com.hk/en/corporate/tenders/Aug17.html
M1065.B-16E,Selective,Maintenance Services for Building Services at SIL(E),"REC Engineering Company LimitedUnits A-D, 15/F, Goodman Kwai Chung Logistics Centre,585-609 Castle Peak Road,Kwai Chung, New Territories,Hong Kong",Not Applicable,"HK$66,285,225",28 Jun 2017,MTR_Tender_Jun17_table1.csv,2017,Jun17,https://www.mtr.com.hk/en/corporate/tenders/Jun17.html
M1124-17E,Selective,Managed Security Services for Operating Railway Data Networks,"Automated Systems (H.K.) Limited15/F., Topsail Plaza,11 On Sum Street,Shatin, New Territories,Hong Kong",Not Applicable,"HK$5,980,528",19 Jun 2017,MTR_Tender_Jun17_table1.csv,2017,Jun17,https://www.mtr.com.hk/en/corporate/tenders/Jun17.html
Q051823,Selective,Provision of Term Workers for MTRCL Managed Properties within New Territories Region,"Advance Engineering (Development) LimitedUnit J & K, 9/F, World Tech Centre,95 How Ming Street, Kwun Tong,Kowloon, Hong Kong",3 Years,"HK$42,457,500",16 Jun 2017,MTR_Tender_Jun17_table1.csv,2017,Jun17,https://www.mtr.com.hk/en/corporate/tenders/Jun17.html
M1135-17(A),Selective,Cleaning Services for Operaing Railway - Packages 1 and 2,"ISS Facilities Services Limited6/F, Dorset House, Taikoo Place, 979 King's Road, Quarry Bay, Hong Kong",Not Applicable,"HK$348,237,108",15 Nov 2017,MTR_Tender_Nov17_table1.csv,2017,Nov17,https://www.mtr.com.hk/en/corporate/tenders/Nov17.html
M1135-17(B),Selective,Cleaning Services for Operaing Railway - Package 5,"ISS Facilities Services Limited6/F, Dorset House, Taikoo Place, 979 King's Road, Quarry Bay, Hong Kong",Not Applicable,"HK$197,740,656",15 Nov 2017,MTR_Tender_Nov17_table1.csv,2017,Nov17,https://www.mtr.com.hk/en/corporate/tenders/Nov17.html
M1135-17(C),Selective,"Cleaning Services for Operaing Railway - Packages 3, 4, 6 and 7","Winson Cleaning Service Co LtdUnit 1-8, 10/F, One Midtown, 11 Hoi Shing Road, Tsuen Wan, Hong Kong",Not Applicable,"HK$376,184,052",15 Nov 2017,MTR_Tender_Nov17_table1.csv,2017,Nov17,https://www.mtr.com.hk/en/corporate/tenders/Nov17.html
Q050427,Selective,Provision of Global Custody and Fund Accounting Services for the MTR Corporation Limited Retirement Scheme,"HSBC Institutional Trust Services (Asia) Limited17/F, Tower 2 & 3, HSBC Centre, 1 Sham Mong Road, Hong Kong",36 Months,Not Disclosed,14 Nov 2017,MTR_Tender_Nov17_table1.csv,2017,Nov17,https://www.mtr.com.hk/en/corporate/tenders/Nov17.html
Q051294,Selective,Renovation at Paradise Mall (for Phase II),"Thomas Lo Contracting LimitedRoom 1202, 12/F., Billion Plaza,8 Cheung Yue Street,Cheung Sha Wan, Kowloon,Hong Kong",1 Job,"HK$62,995,030",2 Nov 2017,MTR_Tender_Nov17_table1.csv,2017,Nov17,https://www.mtr.com.hk/en/corporate/tenders/Nov17.html
Q052309,Selective,Provision of Promoter Services for MTR Malls,"Adecco Personnel Limited12/F., Fortis Tower,77-79 Gloucester Road,Wanchai, Hong Kong",Not Applicable,"HK$6,915,312",1 Nov 2017,MTR_Tender_Nov17_table1.csv,2017,Nov17,https://www.mtr.com.hk/en/corporate/tenders/Nov17.html
Q052750,Selective,Provision of Term Workers for Investment Properties,"Kum Shing (K F) Construction Company LimitedUG 8, Phase II, Newport Centre116 Ma Tau Kok Road,To Kwa Wan, Kowloon, Hong Kong",3 Years,"HK$139,049,064",28 Nov 2017,MTR_Tender_Nov17_table1.csv,2017,Nov17,https://www.mtr.com.hk/en/corporate/tenders/Nov17.html
Q053425,Selective,Term Contracts for General Building Repair and Shop Repartitioning Works for Investment Properties at West Region(Package 2),"Kar Cheung Engineering CompanyUnit 7, 17/F, Kowloon Plaza,485 Castle Peak Road,Lai Chi Kok, Kowloon, Hong Kong",3 Years,"HK$46,000,000",24 Nov 2017,MTR_Tender_Nov17_table1.csv,2017,Nov17,https://www.mtr.com.hk/en/corporate/tenders/Nov17.html
Q054704,Selective,Provision of Inkjet Printing Services for Signage,"DCG Display & Design Company LimitedFlat A, 10/F, Wing Tai Centre, 12 Hing Yip Street, Kwun Tong, Kowloon, Kong Kong",24 Months,Not Disclosed,22 Nov 2017,MTR_Tender_Nov17_table1.csv,2017,Nov17,https://www.mtr.com.hk/en/corporate/tenders/Nov17.html
Q056046,Limited*,C1408 - Solid State Interlocking Data Modification for Provision of Axle Counter at Hong Kong Station of Tung Chung Line Crossings,"ALSTOM Hong Kong LimitedRooms 1011/1012, 10/F, New Kowloon Plaza,38 Tai Kok Tsui Road,Kowloon, Hong Kong",1 Job,"HK$5,307,229",22 Nov 2017,MTR_Tender_Nov17_table1.csv,2017,Nov17,https://www.mtr.com.hk/en/corporate/tenders/Nov17.html
914,Selective,"South Island Line (East): External Works in Harcourt Garden, Admiralty","Build King Construction LimitedUnits 601-605A, 6/F, Tower B,Manulife Financial Centre,223 Wai Yip Street, Kwun Tong,Kowloon, Hong Kong",Not Applicable,"HK$112,766,535",11 Jan 2017,MTR_Tender_Jan17_table1.csv,2017,Jan17,https://www.mtr.com.hk/en/corporate/tenders/Jan17.html
8211,Selective,Express Rail Link: Green Wall for West Kowloon Terminus,"Strongly International LimitedUnit 2, 2/F., Metro Centre II By Collection, 21 Lam Hing Street, Kowloon Bay, Hong Kong",1 Job,"HK$2,744,529",25 Jan 2017,MTR_Tender_Jan17_table1.csv,2017,Jan17,https://www.mtr.com.hk/en/corporate/tenders/Jan17.html
T0954-16C,Selective,Provision of Term Workers for Station Based Maintenance,"Hop Yuen Construction Company2/F., Hop Yeun Centre, 171 Queen's Road Central, Hong Kong",2 Years,Not Disclosed,11 Jan 2017,MTR_Tender_Jan17_table1.csv,2017,Jan17,https://www.mtr.com.hk/en/corporate/tenders/Jan17.html
8221,Selective,Miscellaneous Works and ABWF at Shek Kong Emergency Rescue Siding and Tsat Sing Kong,"U-Tech Engineering Company Limited6/F, 100 To Kwa Wan RoadKowloon, Hong Kong",1 Job,"HK$28,010,035",7 Sep 2017,MTR_Tender_Sep17_table1.csv,2017,Sep17,https://www.mtr.com.hk/en/corporate/tenders/Sep17.html
Q048140,Selective,Alternation and Addition Works and Renovation Works at G/F and 1/F of Maritime Square,"Ka Shun Contractors LimitedRoom 2801, 28/F, Asia Trade Centre, 79 Lei Muk Road, Kwai Chung, NT, Hong Kong",1 Job,"HK$86,498,666",18 Sep 2017,MTR_Tender_Sep17_table1.csv,2017,Sep17,https://www.mtr.com.hk/en/corporate/tenders/Sep17.html
Q050042,Selective,Provision of Sanitary & Hygiene Products,"Watson Hygiene Services LimitedUnits 10-11, 3/F, Hong Leong Industrial Complex, 4 Wang Kwong Road, Kowloon Bay, Hong Kong",3 Years,Not Disclosed,19 Sep 2017,MTR_Tender_Sep17_table1.csv,2017,Sep17,https://www.mtr.com.hk/en/corporate/tenders/Sep17.html
Q052737,Selective,Provision of Preparation Works for COR Examination of MTR Buses,"Wah Kee Auto Body Works Company LimitedFlat 803, 8/F, Kin Wing Industrial Building, Kin Wing Street, Tuen Mun, New Territories, Hong Kong",9 Items,"(Estimate) HK$$8,416,000",28 Sep 2017,MTR_Tender_Sep17_table1.csv,2017,Sep17,https://www.mtr.com.hk/en/corporate/tenders/Sep17.html
Q046863,Selective,Office Leasing & Marketing Agency Service for Central 18 Floors,"Savills (Hong Kong) Limited23/F, Two Exchange Square, 8 Connaught Place, Central, Hong Kong",36 Months,"HK$$16,000,000",30 Nov 2016,MTR_Tender_Feb17_table1.csv,2017,Feb17,https://www.mtr.com.hk/en/corporate/tenders/Feb17.html
Q050624,Selective,Stationary Type Direct Current Flash Butt Welding Machine,"Schlatter Industries AGBrandstrasse 24,CH-8952 Schlieren,Switzerland",1 Job,"CHF1,998,000",5 Dec 2017,MTR_Tender_Dec17_table1.csv,2017,Dec17,https://www.mtr.com.hk/en/corporate/tenders/Dec17.html
Q053342,Selective,Advertising Sales Agency Service for Intercity Train and Station,"HK Easy Shop Limited20/F, Fun Tower, 35 Hung To Road, Kwun Tong, Kowloon, Hong Kong",34 Months,Not Disclosed,19 Dec 2017,MTR_Tender_Dec17_table1.csv,2017,Dec17,https://www.mtr.com.hk/en/corporate/tenders/Dec17.html
Q053754,Selective,Distribution of Free Recruitment Magazine in MTR Stations,"Job Market Publishing LimitedSing Tao News Corporation Building, 7 Chun Cheong Street, Tseung Kwan O Industrial Estate, Tseung Kwan O, New Territories, Hong Kong",2 Years,Not Disclosed,21 Dec 2017,MTR_Tender_Dec17_table1.csv,2017,Dec17,https://www.mtr.com.hk/en/corporate/tenders/Dec17.html
Q055234,Selective,"Collection, Conveyance, Disposal of Sewage Discharged from Kam Tin Building, Kam Sheung Road Station, Pat Heung Depot and Cleaning Out Sump Pits, Grease Traps and Interceptors from West Rail Line Stations and MTR Kam Tin Building","ISS Environmental Services (HK) Ltd.6/F, Dorset House, Taikoo Place979 King's Road, Quarry BayHong Kong",2 Years,"HK$6,867,400",29 Dec 2017,MTR_Tender_Dec17_table1.csv,2017,Dec17,https://www.mtr.com.hk/en/corporate/tenders/Dec17.html
Q055402,Selective,Provision of Legal Services to enforce Deed of Mutual Covenants (DMC) in Properties Managed by MTR Corporation Limited,"Deacons5/F, Alexandra House, 16 Charter Road, Central, Hong Kong",3 Years,Not Disclosed,21 Dec 2017,MTR_Tender_Dec17_table1.csv,2017,Dec17,https://www.mtr.com.hk/en/corporate/tenders/Dec17.html
Q055472,Selective,2-Year Term Contract for Supply of Steel Furniture,"Chung Wah Steel Furniture Factory Co. Ltd7/F, Chinaweal Centre, 414-424 Jaffe Road, Wanchai, Hong Kong",2 Years,Not Disclosed,7 Dec 2017,MTR_Tender_Dec17_table1.csv,2017,Dec17,https://www.mtr.com.hk/en/corporate/tenders/Dec17.html
